Info
62984  >  443 [ACK] Seq=675 Ack=751928 Win=4162 Len=0
"443  >  62984 [PSH, ACK] Seq=7225123 Ack=7062 Win=536 Len=1440 [TCP segment of a reassembled PDU]"
443  >  59152 Len=27
62984  >  443 [ACK] Seq=8979 Ack=9549481 Win=4162 Len=0
443  >  62984 [ACK] Seq=9546601 Ack=8979 Win=543 Len=1440 [TCP segment of a reassembled PDU]
443  >  62984 [ACK] Seq=6853950 Ack=6423 Win=534 Len=1440 [TCP segment of a reassembled PDU]
"[TCP Previous segment not captured] 443  >  62984 [PSH, ACK] Seq=7629494 Ack=7062 Win=536 Len=1440 [TCP segment of a reassembled PDU]"
443  >  62984 [ACK] Seq=10574150 Ack=10255 Win=548 Len=1440 [TCP segment of a reassembled PDU]
62984  >  443 [ACK] Seq=11532 Ack=12150359 Win=4162 Len=0
62984  >  443 [ACK] Seq=7062 Ack=7670811 Win=4162 Len=0
[TCP Dup ACK 1453#41] 62984  >  443 [ACK] Seq=675 Ack=1136839 Win=4162 Len=0 SLE=1190119 SRE=1207399 SLE=1180039 SRE=1188679 SLE=1169959 SRE=1175719 SLE=1177159 SRE=1178599
62984  >  443 [ACK] Seq=10255 Ack=10870718 Win=4162 Len=0
"443  >  62984 [PSH, ACK] Seq=3443560 Ack=3230 Win=522 Len=1440 [TCP segment of a reassembled PDU]"
[TCP Dup ACK 19771#1] 62984  >  443 [ACK] Seq=14088 Ack=14175369 Win=4162 Len=0 SLE=14176809 SRE=14178249
62984  >  443 [ACK] Seq=3868 Ack=4010262 Win=4162 Len=0
Application Data
62984  >  443 [ACK] Seq=4506 Ack=4512426 Win=4162 Len=0
62984  >  443 [ACK] Seq=3230 Ack=3406120 Win=4162 Len=0
443  >  49926 Len=1200
443  >  62984 [ACK] Seq=5664001 Ack=5145 Win=529 Len=1440 [TCP segment of a reassembled PDU]
443  >  62984 [ACK] Seq=4829556 Ack=4506 Win=526 Len=1440 [TCP segment of a reassembled PDU]
443  >  62984 [ACK] Seq=3417640 Ack=3230 Win=522 Len=1440 [TCP segment of a reassembled PDU]
[TCP Out-Of-Order] 443  >  62984 [ACK] Seq=7204963 Ack=7062 Win=536 Len=1440 [TCP segment of a reassembled PDU]
443  >  62984 [ACK] Seq=13654101 Ack=13449 Win=559 Len=1440 [TCP segment of a reassembled PDU]
"443  >  62984 [PSH, ACK] Seq=3579554 Ack=3230 Win=522 Len=1440 [TCP segment of a reassembled PDU]"
58506  >  443 Len=80
Application Data
[TCP Out-Of-Order] 443  >  62984 [ACK] Seq=8058458 Ack=7701 Win=538 Len=1440 [TCP segment of a reassembled PDU]
443  >  49926 Len=23
443  >  62984 [ACK] Seq=1156999 Ack=675 Win=512 Len=1440 [TCP segment of a reassembled PDU]
62984  >  443 [ACK] Seq=2592 Ack=2675710 Win=4162 Len=0
[TCP Out-Of-Order] 443  >  62984 [ACK] Seq=1112359 Ack=675 Win=512 Len=1440 [TCP segment of a reassembled PDU]
[TCP Out-Of-Order] 443  >  62984 [ACK] Seq=10641830 Ack=10255 Win=548 Len=1440 [TCP segment of a reassembled PDU]
[TCP Out-Of-Order] 443  >  62984 [ACK] Seq=12556438 Ack=12171 Win=555 Len=1440 [TCP segment of a reassembled PDU]
[TCP Dup ACK 6659#1] 62984  >  443 [ACK] Seq=3868 Ack=3861927 Win=4162 Len=0 SLE=3863367 SRE=3864807
63666  >  53 [ACK] Seq=1 Ack=1 Win=131072 Len=0
[TCP Out-Of-Order] 443  >  62984 [ACK] Seq=12929801 Ack=12810 Win=557 Len=1440 [TCP segment of a reassembled PDU]
[TCP Out-Of-Order] 443  >  62984 [ACK] Seq=7874710 Ack=7701 Win=538 Len=1440 [TCP segment of a reassembled PDU]
[TCP Out-Of-Order] 443  >  62984 [ACK] Seq=13883611 Ack=13449 Win=559 Len=1440 [TCP segment of a reassembled PDU]
443  >  63667 [ACK] Seq=5970 Ack=1293 Win=4193280 Len=0
[TCP Keep-Alive ACK] 443  >  63499 [ACK] Seq=1 Ack=2 Win=277 Len=0 SLE=1 SRE=2
"443  >  62984 [PSH, ACK] Seq=891177 Ack=675 Win=512 Len=1440 [TCP segment of a reassembled PDU]"
443  >  62984 [ACK] Seq=14290478 Ack=14088 Win=562 Len=1440 [TCP segment of a reassembled PDU]
443  >  61743 Len=806
62984  >  443 [ACK] Seq=10893 Ack=11309511 Win=4162 Len=0
[TCP Dup ACK 1453#30] 62984  >  443 [ACK] Seq=675 Ack=1136839 Win=4162 Len=0 SLE=1190119 SRE=1192999 SLE=1180039 SRE=1185799 SLE=1187239 SRE=1188679 SLE=1169959 SRE=1175719
443  >  62984 [ACK] Seq=4541226 Ack=4506 Win=526 Len=1440 [TCP segment of a reassembled PDU]
[TCP Dup ACK 13091#2] 62984  >  443 [ACK] Seq=8340 Ack=8950257 Win=4162 Len=0 SLE=8954577 SRE=8956017 SLE=8951697 SRE=8953137
"443  >  62984 [PSH, ACK] Seq=14356718 Ack=14088 Win=562 Len=1440 [TCP segment of a reassembled PDU]"
"53  >  63631 [FIN, ACK] Seq=113 Ack=40 Win=65536 Len=0"
"443  >  62984 [PSH, ACK] Seq=8038298 Ack=7701 Win=538 Len=1440 [TCP segment of a reassembled PDU]"
"443  >  62984 [PSH, ACK] Seq=10275475 Ack=10220 Win=548 Len=566 [TCP segment of a reassembled PDU]"
443  >  62984 [ACK] Seq=6297853 Ack=5784 Win=531 Len=1440 [TCP segment of a reassembled PDU]
63634  >  53 [ACK] Seq=1 Ack=1 Win=131072 Len=0
62984  >  443 [ACK] Seq=10255 Ack=10618790 Win=4162 Len=0
"[TCP Previous segment not captured] 443  >  62984 [PSH, ACK] Seq=3880647 Ack=3868 Win=524 Len=1440 [TCP segment of a reassembled PDU]"
443  >  62984 [ACK] Seq=8592968 Ack=8340 Win=541 Len=1440 [TCP segment of a reassembled PDU]
"443  >  62984 [PSH, ACK] Seq=4037622 Ack=3868 Win=524 Len=1440 [TCP segment of a reassembled PDU]"
"443  >  62984 [PSH, ACK] Seq=14650307 Ack=14088 Win=562 Len=1440 [TCP segment of a reassembled PDU]"
443  >  62984 [ACK] Seq=2595251 Ack=2592 Win=519 Len=1440 [TCP segment of a reassembled PDU]
"443  >  62984 [PSH, ACK] Seq=8021018 Ack=7701 Win=538 Len=1440 [TCP segment of a reassembled PDU]"
63649  >  443 [SYN] Seq=0 Win=64240 Len=0 MSS=1460 WS=256 SACK_PERM
443  >  62984 [ACK] Seq=10130641 Ack=9617 Win=545 Len=1440 [TCP segment of a reassembled PDU]
443  >  62984 [ACK] Seq=5914555 Ack=5784 Win=531 Len=1440 [TCP segment of a reassembled PDU]
"[TCP Previous segment not captured] 443  >  62984 [PSH, ACK] Seq=5659681 Ack=5145 Win=529 Len=1440 [TCP segment of a reassembled PDU]"
62984  >  443 [ACK] Seq=7701 Ack=7903510 Win=4162 Len=0
443  >  62984 [ACK] Seq=10227535 Ack=9617 Win=545 Len=1440 [TCP segment of a reassembled PDU]
443  >  62984 [ACK] Seq=987079 Ack=675 Win=512 Len=1440 [TCP segment of a reassembled PDU]
[TCP Out-Of-Order] 443  >  62984 [ACK] Seq=14363918 Ack=14088 Win=562 Len=1440 [TCP segment of a reassembled PDU]
443  >  62984 [ACK] Seq=12652918 Ack=12171 Win=555 Len=1440 [TCP segment of a reassembled PDU]
[TCP Previous segment not captured] 443  >  62984 [ACK] Seq=10334908 Ack=10255 Win=548 Len=1440 [TCP segment of a reassembled PDU]
[TCP Out-Of-Order] 443  >  62984 [ACK] Seq=5833035 Ack=5784 Win=531 Len=1440 [TCP segment of a reassembled PDU]
62984  >  443 [ACK] Seq=1953 Ack=2461638 Win=4162 Len=0 SLE=2463078 SRE=2464518
62984  >  443 [ACK] Seq=10255 Ack=10824710 Win=4162 Len=0 SLE=10826150 SRE=10827590
443  >  62984 [ACK] Seq=1546424 Ack=1314 Win=515 Len=1440 [TCP segment of a reassembled PDU]
55335  >  443 Len=1250
[TCP Out-Of-Order] 443  >  62984 [ACK] Seq=7310083 Ack=7062 Win=536 Len=1440 [TCP segment of a reassembled PDU]
"443  >  62984 [PSH, ACK] Seq=12830043 Ack=12810 Win=557 Len=1440 [TCP segment of a reassembled PDU]"
62984  >  443 [ACK] Seq=7062 Ack=7482614 Win=4162 Len=0
443  >  49926 Len=113
443  >  62984 [ACK] Seq=4205287 Ack=3868 Win=524 Len=1440 [TCP segment of a reassembled PDU]
62984  >  443 [ACK] Seq=11532 Ack=12072955 Win=4162 Len=0
443  >  62984 [ACK] Seq=9911761 Ack=9617 Win=545 Len=1440 [TCP segment of a reassembled PDU]
62984  >  443 [ACK] Seq=14088 Ack=14555267 Win=4162 Len=0
"443  >  62984 [PSH, ACK] Seq=12792598 Ack=12171 Win=555 Len=1440 [TCP segment of a reassembled PDU]"
58506  >  443 Len=36
443  >  62984 [ACK] Seq=8205338 Ack=7701 Win=538 Len=1440 [TCP segment of a reassembled PDU]
[TCP Dup ACK 16090#1] 62984  >  443 [ACK] Seq=10893 Ack=11194071 Win=4162 Len=0 SLE=11195511 SRE=11199831
[TCP Dup ACK 7607#1] 62984  >  443 [ACK] Seq=4506 Ack=4701085 Win=4162 Len=0 SLE=4702525 SRE=4703965
62984  >  443 [ACK] Seq=1314 Ack=1886232 Win=4162 Len=0 SLE=1887672 SRE=1891178
[TCP Fast Retransmission] 443  >  62984 [ACK] Seq=8429119 Ack=8340 Win=541 Len=1440 [TCP segment of a reassembled PDU]
443  >  62984 [ACK] Seq=4634845 Ack=4506 Win=526 Len=1440 [TCP segment of a reassembled PDU]
62984  >  443 [ACK] Seq=12171 Ack=12802678 Win=4162 Len=0
[TCP Dup ACK 19162#5] 62984  >  443 [ACK] Seq=13449 Ack=13722975 Win=4162 Len=0 SLE=13736333 SRE=13737773 SLE=13724415 SRE=13733453
[TCP Dup ACK 14516#46] 62984  >  443 [ACK] Seq=9617 Ack=9995281 Win=4162 Len=0 SLE=10078801 SRE=10080241 SLE=10073041 SRE=10077361 SLE=10067281 SRE=10068721 SLE=10012561 SRE=10065841
"443  >  62984 [PSH, ACK] Seq=8097338 Ack=7701 Win=538 Len=1440 [TCP segment of a reassembled PDU]"
[TCP Dup ACK 10052#1] 62984  >  443 [ACK] Seq=6423 Ack=6670800 Win=4162 Len=0 SLE=6672240 SRE=6673680
443  >  62984 [ACK] Seq=3206032 Ack=3195 Win=522 Len=1440 [TCP segment of a reassembled PDU]
62984  >  443 [ACK] Seq=3868 Ack=3873447 Win=4162 Len=0
62984  >  443 [ACK] Seq=5749 Ack=5779087 Win=4162 Len=0 SLE=5780527 SRE=5780828
443  >  49926 Len=586
443  >  49926 Len=46
443  >  62984 [ACK] Seq=11565415 Ack=11532 Win=552 Len=1440 [TCP segment of a reassembled PDU]
[TCP Dup ACK 14516#15] 62984  >  443 [ACK] Seq=9617 Ack=9995281 Win=4162 Len=0 SLE=10012561 SRE=10026961 SLE=9999601 SRE=10008241 SLE=9996721 SRE=9998161
443  >  62984 [ACK] Seq=1288557 Ack=1279 Win=515 Len=1440 [TCP segment of a reassembled PDU]
"443  >  62984 [PSH, ACK] Seq=7160782 Ack=7062 Win=536 Len=1440 [TCP segment of a reassembled PDU]"
62984  >  443 [ACK] Seq=9617 Ack=9675735 Win=4162 Len=0
Application Data
62984  >  443 [ACK] Seq=11532 Ack=11812450 Win=4162 Len=0
"[TCP Previous segment not captured] 443  >  62984 [PSH, ACK] Seq=13725855 Ack=13449 Win=559 Len=1440 [TCP segment of a reassembled PDU]"
[TCP Previous segment not captured] 443  >  62984 [ACK] Seq=8541378 Ack=8340 Win=541 Len=1440 [TCP segment of a reassembled PDU]
443  >  49926 Len=1092
62984  >  443 [ACK] Seq=14088 Ack=14673347 Win=4162 Len=0
443  >  62984 [ACK] Seq=6485959 Ack=6423 Win=534 Len=1440 [TCP segment of a reassembled PDU]
RST. Root = 32768/0/34:a8:4e:07:9d:d8  Cost = 0  Port = 0x8001
[TCP Out-Of-Order] 443  >  62984 [ACK] Seq=1970270 Ack=1953 Win=517 Len=1440 [TCP segment of a reassembled PDU]
62984  >  443 [ACK] Seq=10255 Ack=10511300 Win=4162 Len=0
443  >  62984 [ACK] Seq=1260381 Ack=675 Win=512 Len=1440 [TCP segment of a reassembled PDU]
Application Data
"[TCP Previous segment not captured] 443  >  62984 [PSH, ACK] Seq=3961685 Ack=3868 Win=524 Len=1440 [TCP segment of a reassembled PDU]"
62984  >  443 [ACK] Seq=9617 Ack=9855626 Win=4162 Len=0
443  >  49185 Len=22
443  >  62984 [ACK] Seq=14445827 Ack=14088 Win=562 Len=1440 [TCP segment of a reassembled PDU]
62984  >  443 [ACK] Seq=12171 Ack=12359158 Win=4162 Len=0
443  >  62984 [ACK] Seq=11748122 Ack=11532 Win=552 Len=1440 [TCP segment of a reassembled PDU]
"[TCP Previous segment not captured] 443  >  62984 [PSH, ACK] Seq=7052011 Ack=7027 Win=536 Len=1256 [TCP segment of a reassembled PDU]"
49926  >  443 Len=45
443  >  62984 [ACK] Seq=4649245 Ack=4506 Win=526 Len=1440 [TCP segment of a reassembled PDU]
62984  >  443 [ACK] Seq=9617 Ack=9659895 Win=4162 Len=0
62984  >  443 [ACK] Seq=8340 Ack=8753554 Win=4162 Len=0
[TCP Dup ACK 7800#1] 62984  >  443 [ACK] Seq=4506 Ack=4879956 Win=4162 Len=0 SLE=4881396 SRE=4882836
443  >  62984 [ACK] Seq=9947761 Ack=9617 Win=545 Len=1440 [TCP segment of a reassembled PDU]
62984  >  443 [ACK] Seq=1953 Ack=2392518 Win=4162 Len=0
[TCP Out-Of-Order] 443  >  62984 [ACK] Seq=4559041 Ack=4506 Win=526 Len=1440 [TCP segment of a reassembled PDU]
"443  >  62984 [PSH, ACK] Seq=6533875 Ack=6423 Win=534 Len=1440 [TCP segment of a reassembled PDU]"
443  >  61183 Len=162
62984  >  443 [ACK] Seq=1953 Ack=2215782 Win=4162 Len=0
"443  >  62984 [PSH, ACK] Seq=6019675 Ack=5784 Win=531 Len=1440 [TCP segment of a reassembled PDU]"
62984  >  443 [ACK] Seq=8340 Ack=8765074 Win=4162 Len=0
[TCP Dup ACK 14323#1] 62984  >  443 [ACK] Seq=9617 Ack=9831146 Win=4162 Len=0 SLE=9832586 SRE=9834026
Application Data
443  >  62984 [ACK] Seq=14419907 Ack=14088 Win=562 Len=1440 [TCP segment of a reassembled PDU]
"443  >  62984 [PSH, ACK] Seq=11891580 Ack=11532 Win=552 Len=1440 [TCP segment of a reassembled PDU]"
62984  >  443 [ACK] Seq=36 Ack=283412 Win=4162 Len=0
62984  >  443 [ACK] Seq=1314 Ack=1738500 Win=4162 Len=0 SLE=1741380 SRE=1742820
[TCP Dup ACK 503#1] 62984  >  443 [ACK] Seq=36 Ack=402823 Win=4162 Len=0 SLE=407143 SRE=408583 SLE=404263 SRE=405703
[TCP Dup ACK 17530#5] 62984  >  443 [ACK] Seq=12171 Ack=12317398 Win=4162 Len=0 SLE=12328918 SRE=12336118 SLE=12321718 SRE=12327478 SLE=12318838 SRE=12320278
"[TCP Previous segment not captured] 443  >  62984 [PSH, ACK] Seq=5399286 Ack=5145 Win=529 Len=1440 [TCP segment of a reassembled PDU]"
62984  >  443 [ACK] Seq=11532 Ack=11888700 Win=4162 Len=0 SLE=11890140 SRE=11891580
443  >  62984 [ACK] Seq=7597814 Ack=7062 Win=536 Len=1440 [TCP segment of a reassembled PDU]
"443  >  62984 [PSH, ACK] Seq=4822356 Ack=4506 Win=526 Len=1440 [TCP segment of a reassembled PDU]"
62984  >  443 [ACK] Seq=12810 Ack=13089641 Win=4162 Len=0
[TCP Out-Of-Order] 443  >  62984 [ACK] Seq=8287418 Ack=7701 Win=538 Len=1440 [TCP segment of a reassembled PDU]
62984  >  443 [ACK] Seq=4506 Ack=4864116 Win=4162 Len=0
62984  >  443 [ACK] Seq=7062 Ack=7341494 Win=4162 Len=0 SLE=7345814 SRE=7347254
443  >  62984 [ACK] Seq=3543554 Ack=3230 Win=522 Len=1440 [TCP segment of a reassembled PDU]
"443  >  62984 [PSH, ACK] Seq=12566518 Ack=12171 Win=555 Len=1440 [TCP segment of a reassembled PDU]"
"[TCP Previous segment not captured] 443  >  62984 [PSH, ACK] Seq=5746837 Ack=5145 Win=529 Len=1440 [TCP segment of a reassembled PDU]"
443  >  62984 [ACK] Seq=2893150 Ack=2592 Win=519 Len=1440 [TCP segment of a reassembled PDU]
62984  >  443 [ACK] Seq=675 Ack=927177 Win=4162 Len=0
62984  >  443 [ACK] Seq=7701 Ack=7985892 Win=4162 Len=0
[TCP Out-Of-Order] 443  >  62984 [ACK] Seq=835017 Ack=675 Win=512 Len=1440 [TCP segment of a reassembled PDU]
[TCP Retransmission] 443  >  62984 [ACK] Seq=14128475 Ack=14088 Win=562 Len=1440
[TCP Out-Of-Order] 443  >  62984 [ACK] Seq=13529262 Ack=13449 Win=559 Len=1440 [TCP segment of a reassembled PDU]
443  >  62984 [ACK] Seq=1207399 Ack=675 Win=512 Len=1440 [TCP segment of a reassembled PDU]
443  >  62984 [ACK] Seq=3645794 Ack=3230 Win=522 Len=1440 [TCP segment of a reassembled PDU]
443  >  62984 [ACK] Seq=13587463 Ack=13449 Win=559 Len=1440 [TCP segment of a reassembled PDU]
63862  >  443 Len=78
443  >  62984 [ACK] Seq=10262515 Ack=10220 Win=548 Len=1440 [TCP segment of a reassembled PDU]
62984  >  443 [ACK] Seq=7062 Ack=7199203 Win=4162 Len=0 SLE=7202083 SRE=7203523
[TCP Previous segment not captured] 443  >  62984 [ACK] Seq=1404833 Ack=1314 Win=515 Len=1440 [TCP segment of a reassembled PDU]
Application Data
443  >  62984 [ACK] Seq=13442441 Ack=12810 Win=557 Len=1440 [TCP segment of a reassembled PDU]
443  >  49926 Len=1200
[TCP Previous segment not captured] 443  >  62984 [ACK] Seq=6277693 Ack=5784 Win=531 Len=1440 [TCP segment of a reassembled PDU]
63862  >  443 Len=32
443  >  62984 [ACK] Seq=7320163 Ack=7062 Win=536 Len=1440 [TCP segment of a reassembled PDU]
443  >  51767 Len=816
62984  >  443 [ACK] Seq=12810 Ack=13236521 Win=4162 Len=0
62984  >  443 [ACK] Seq=4506 Ack=4714045 Win=4162 Len=0
"[TCP Previous segment not captured] 443  >  62984 [PSH, ACK] Seq=7958230 Ack=7701 Win=538 Len=1440 [TCP segment of a reassembled PDU]"
62984  >  443 [ACK] Seq=10255 Ack=10433540 Win=4162 Len=0
[TCP Dup ACK 19369#48] 62984  >  443 [ACK] Seq=13449 Ack=13893691 Win=4162 Len=0 SLE=13985851 SRE=13987291 SLE=13981531 SRE=13984411 SLE=13895131 SRE=13945531 SLE=13978651 SRE=13980091
[TCP Dup ACK 1453#29] 62984  >  443 [ACK] Seq=675 Ack=1136839 Win=4162 Len=0 SLE=1180039 SRE=1185799 SLE=1190119 SRE=1191559 SLE=1187239 SRE=1188679 SLE=1169959 SRE=1175719
443  >  62984 [ACK] Seq=10702310 Ack=10255 Win=548 Len=1440 [TCP segment of a reassembled PDU]
62984  >  443 [ACK] Seq=7701 Ack=7915030 Win=4162 Len=0
"[TCP Previous segment not captured] 443  >  62984 [PSH, ACK] Seq=10826150 Ack=10255 Win=548 Len=1440 [TCP segment of a reassembled PDU]"
443  >  62984 [ACK] Seq=10614470 Ack=10255 Win=548 Len=1440 [TCP segment of a reassembled PDU]
62984  >  443 [ACK] Seq=2592 Ack=3094750 Win=4162 Len=0
62984  >  443 [ACK] Seq=3230 Ack=3476680 Win=4162 Len=0
[TCP Dup ACK 10190#1] 62984  >  443 [ACK] Seq=6423 Ack=6789150 Win=4162 Len=0 SLE=6790590 SRE=6792030
[TCP Previous segment not captured] 443  >  62984 [ACK] Seq=1582374 Ack=1314 Win=515 Len=1440 [TCP segment of a reassembled PDU]
443  >  62984 [ACK] Seq=14138555 Ack=14088 Win=562 Len=1440 [TCP segment of a reassembled PDU]
"[TCP Previous segment not captured] 443  >  62984 [PSH, ACK] Seq=11254791 Ack=10893 Win=550 Len=1440 [TCP segment of a reassembled PDU]"
61743  >  443 Len=33
"443  >  62984 [PSH, ACK] Seq=12668758 Ack=12171 Win=555 Len=1440 [TCP segment of a reassembled PDU]"
[TCP Previous segment not captured] 443  >  62984 [ACK] Seq=8737714 Ack=8340 Win=541 Len=1440 [TCP segment of a reassembled PDU]
"443  >  62984 [PSH, ACK] Seq=11011291 Ack=10893 Win=550 Len=1440 [TCP segment of a reassembled PDU]"
443  >  62984 [ACK] Seq=5927515 Ack=5784 Win=531 Len=1440 [TCP segment of a reassembled PDU]
443  >  62984 [ACK] Seq=2056608 Ack=1953 Win=517 Len=1440 [TCP segment of a reassembled PDU]
443  >  49926 Len=1200
[TCP Dup ACK 15338#1] 62984  >  443 [ACK] Seq=10255 Ack=10595750 Win=4162 Len=0 SLE=10600070 SRE=10601510
62984  >  443 [ACK] Seq=675 Ack=784802 Win=4162 Len=0
443  >  62984 [ACK] Seq=9062882 Ack=8979 Win=543 Len=1440 [TCP segment of a reassembled PDU]
55335  >  443 Len=1250
62984  >  443 [ACK] Seq=9617 Ack=9805226 Win=4162 Len=0 SLE=9808106 SRE=9809546
Application Data
443  >  62984 [ACK] Seq=4063542 Ack=3868 Win=524 Len=1440 [TCP segment of a reassembled PDU]
"[TCP Previous segment not captured] 443  >  62984 [PSH, ACK] Seq=11628543 Ack=11532 Win=552 Len=1440 [TCP segment of a reassembled PDU]"
443  >  62984 [ACK] Seq=11668356 Ack=11532 Win=552 Len=1440 [TCP segment of a reassembled PDU]
[TCP Dup ACK 10898#1] 62984  >  443 [ACK] Seq=7062 Ack=7274083 Win=4162 Len=0 SLE=7275523 SRE=7276963
443  >  62984 [ACK] Seq=5900715 Ack=5784 Win=531 Len=1440 [TCP segment of a reassembled PDU]
443  >  49926 Len=1200
"443  >  62984 [PSH, ACK] Seq=13443881 Ack=12810 Win=557 Len=1440 [TCP segment of a reassembled PDU]"
443  >  62984 [ACK] Seq=5930395 Ack=5784 Win=531 Len=1440 [TCP segment of a reassembled PDU]
443  >  62984 [ACK] Seq=13975771 Ack=13449 Win=559 Len=1440 [TCP segment of a reassembled PDU]
55335  >  443 Len=1250
"443  >  62984 [PSH, ACK] Seq=3612674 Ack=3230 Win=522 Len=1440 [TCP segment of a reassembled PDU]"
RST. Root = 32768/0/34:a8:4e:07:9d:d8  Cost = 0  Port = 0x8001
[TCP Out-Of-Order] 443  >  62984 [ACK] Seq=5767567 Ack=5749 Win=531 Len=1440 [TCP segment of a reassembled PDU]
[TCP Dup ACK 19531#1] 62984  >  443 [ACK] Seq=13449 Ack=13968571 Win=4162 Len=0 SLE=13985851 SRE=13997371 SLE=14029051 SRE=14034811 SLE=14026171 SRE=14027611 SLE=14023291 SRE=14024731
[TCP Previous segment not captured] 443  >  62984 [ACK] Seq=1043239 Ack=675 Win=512 Len=1440 [TCP segment of a reassembled PDU]
55074  >  443 Len=1250
[TCP Previous segment not captured] 443  >  62984 [ACK] Seq=1731300 Ack=1314 Win=515 Len=1440 [TCP segment of a reassembled PDU]
443  >  62984 [ACK] Seq=6405739 Ack=6388 Win=534 Len=1440 [TCP segment of a reassembled PDU]
62984  >  443 [ACK] Seq=6423 Ack=6636115 Win=4162 Len=0
[TCP Dup ACK 4356#14] 62984  >  443 [ACK] Seq=2592 Ack=2957950 Win=4162 Len=0 SLE=2975230 SRE=2986750 SLE=2960830 SRE=2972350
443  >  62984 [ACK] Seq=4047702 Ack=3868 Win=524 Len=1440 [TCP segment of a reassembled PDU]
443  >  62984 [ACK] Seq=11163831 Ack=10893 Win=550 Len=1440 [TCP segment of a reassembled PDU]
62984  >  443 [ACK] Seq=8979 Ack=9227944 Win=4162 Len=0 SLE=9229384 SRE=9230824
[TCP Dup ACK 2234#1] 62984  >  443 [ACK] Seq=1314 Ack=1663620 Win=4162 Len=0 SLE=1666500 SRE=1667940
Application Data
443  >  49926 Len=1200
62984  >  443 [ACK] Seq=8979 Ack=9555241 Win=4162 Len=0
62984  >  443 [ACK] Seq=675 Ack=806968 Win=4162 Len=0 SLE=809848 SRE=811288
62984  >  443 [ACK] Seq=36 Ack=158132 Win=4162 Len=0
443  >  62984 [ACK] Seq=11393031 Ack=10893 Win=550 Len=1440 [TCP segment of a reassembled PDU]
[TCP Out-Of-Order] 443  >  62984 [ACK] Seq=8010938 Ack=7701 Win=538 Len=1440 [TCP segment of a reassembled PDU]
62984  >  443 [ACK] Seq=3230 Ack=3798434 Win=4162 Len=0
[TCP Previous segment not captured] 443  >  62984 [ACK] Seq=1278227 Ack=675 Win=512 Len=1440 [TCP segment of a reassembled PDU]
[TCP Out-Of-Order] 443  >  62984 [ACK] Seq=10159441 Ack=9617 Win=545 Len=1440 [TCP segment of a reassembled PDU]
62984  >  443 [ACK] Seq=36 Ack=89519 Win=4162 Len=0
"Standard query 0x2118 PTR _arduino._tcp.local, ""QM"" question"
443  >  62984 [ACK] Seq=10932806 Ack=10893 Win=550 Len=1440 [TCP segment of a reassembled PDU]
62984  >  443 [ACK] Seq=12171 Ack=12200440 Win=4162 Len=0
443  >  62984 [ACK] Seq=5739637 Ack=5145 Win=529 Len=1440 [TCP segment of a reassembled PDU]
"Server Hello, Change Cipher Spec, Encrypted Handshake Message"
[TCP Previous segment not captured] 443  >  62984 [ACK] Seq=641982 Ack=640 Win=512 Len=1440 [TCP segment of a reassembled PDU]
"443  >  62984 [PSH, ACK] Seq=4949076 Ack=4506 Win=526 Len=1440 [TCP segment of a reassembled PDU]"
RST. Root = 32768/0/34:a8:4e:07:9d:d8  Cost = 0  Port = 0x8001
62984  >  443 [ACK] Seq=13449 Ack=13810171 Win=4162 Len=0
62984  >  443 [ACK] Seq=1314 Ack=1690980 Win=4162 Len=0
443  >  62984 [ACK] Seq=12396598 Ack=12171 Win=555 Len=1440 [TCP segment of a reassembled PDU]
62984  >  443 [ACK] Seq=12810 Ack=12869321 Win=4162 Len=0
"63639  >  53 [FIN, ACK] Seq=36 Ack=52 Win=131072 Len=0"
443  >  62984 [ACK] Seq=6009595 Ack=5784 Win=531 Len=1440 [TCP segment of a reassembled PDU]
49926  >  443 Len=44
62984  >  443 [ACK] Seq=5145 Ack=5455817 Win=4162 Len=0
[TCP Out-Of-Order] 443  >  62984 [ACK] Seq=2025357 Ack=1953 Win=517 Len=1440 [TCP segment of a reassembled PDU]
62984  >  443 [ACK] Seq=8340 Ack=8400319 Win=4162 Len=0
"Standard query 0x47b3 PTR _arduino._tcp.local, ""QM"" question"
[TCP Dup ACK 19369#43] 62984  >  443 [ACK] Seq=13449 Ack=13893691 Win=4162 Len=0 SLE=13895131 SRE=13941211 SLE=13972891 SRE=13977211 SLE=13964251 SRE=13968571 SLE=13946971 SRE=13961371
62984  >  443 [ACK] Seq=9617 Ack=9823946 Win=4162 Len=0
"443  >  62984 [PSH, ACK] Seq=12832923 Ack=12810 Win=557 Len=1440 [TCP segment of a reassembled PDU]"
[TCP Out-Of-Order] 443  >  62984 [ACK] Seq=7628054 Ack=7062 Win=536 Len=1440 [TCP segment of a reassembled PDU]
[TCP Out-Of-Order] 443  >  62984 [ACK] Seq=2630231 Ack=2592 Win=519 Len=1440 [TCP segment of a reassembled PDU]
443  >  62984 [ACK] Seq=4477447 Ack=3868 Win=524 Len=1440 [TCP segment of a reassembled PDU]
RST. Root = 32768/0/34:a8:4e:07:9d:d8  Cost = 0  Port = 0x8001
[TCP Out-Of-Order] 443  >  62984 [ACK] Seq=6992449 Ack=6423 Win=534 Len=1440 [TCP segment of a reassembled PDU]
443  >  62984 [ACK] Seq=9665655 Ack=9617 Win=545 Len=1440 [TCP segment of a reassembled PDU]
"[TCP Previous segment not captured] 443  >  62984 [PSH, ACK] Seq=3838754 Ack=3230 Win=522 Len=1440 [TCP segment of a reassembled PDU]"
62984  >  443 [ACK] Seq=3868 Ack=4018902 Win=4162 Len=0
62984  >  443 [ACK] Seq=4506 Ack=4660765 Win=4162 Len=0
[TCP Dup ACK 17530#8] 62984  >  443 [ACK] Seq=12171 Ack=12317398 Win=4162 Len=0 SLE=12338998 SRE=12341878 SLE=12328918 SRE=12337558 SLE=12318838 SRE=12327478
62984  >  443 [ACK] Seq=5145 Ack=5142826 Win=4162 Len=0
"443  >  62984 [PSH, ACK] Seq=14265998 Ack=14088 Win=562 Len=1440 [TCP segment of a reassembled PDU]"
443  >  49926 Len=1200
[TCP Dup ACK 14213#1] 62984  >  443 [ACK] Seq=9617 Ack=9741300 Win=4162 Len=0 SLE=9742740 SRE=9744180
55335  >  443 Len=1250
443  >  62984 [ACK] Seq=2254278 Ack=1953 Win=517 Len=1440 [TCP segment of a reassembled PDU]
49926  >  443 Len=44
443  >  49926 Len=632
62984  >  443 [ACK] Seq=12171 Ack=12464278 Win=4162 Len=0
443  >  62984 [ACK] Seq=4465927 Ack=3868 Win=524 Len=1440 [TCP segment of a reassembled PDU]
62984  >  443 [ACK] Seq=7701 Ack=7799357 Win=4162 Len=0
[TCP Previous segment not captured] 443  >  62984 [ACK] Seq=6269053 Ack=5784 Win=531 Len=1440 [TCP segment of a reassembled PDU]
443  >  49926 Len=1200
Application Data
443  >  49926 Len=985
62984  >  443 [ACK] Seq=5784 Ack=6125053 Win=4162 Len=0 SLE=6127933 SRE=6129373
443  >  62984 [ACK] Seq=385543 Ack=36 Win=510 Len=1440 [TCP segment of a reassembled PDU]
[TCP Out-Of-Order] 443  >  62984 [ACK] Seq=7376054 Ack=7062 Win=536 Len=1440 [TCP segment of a reassembled PDU]
"443  >  63390 [FIN, ACK] Seq=40 Ack=2 Win=8 Len=0"
62984  >  443 [ACK] Seq=36 Ack=22346 Win=4162 Len=0
"443  >  62984 [PSH, ACK] Seq=2887390 Ack=2592 Win=519 Len=1440 [TCP segment of a reassembled PDU]"
62984  >  443 [ACK] Seq=13449 Ack=13613781 Win=4162 Len=0
443  >  62984 [ACK] Seq=6077533 Ack=5784 Win=531 Len=1440 [TCP segment of a reassembled PDU]
62984  >  443 [ACK] Seq=14088 Ack=14322158 Win=4162 Len=0
[TCP Out-Of-Order] 443  >  62984 [ACK] Seq=11216931 Ack=10893 Win=550 Len=1440 [TCP segment of a reassembled PDU]
443  >  62984 [ACK] Seq=3724994 Ack=3230 Win=522 Len=1440 [TCP segment of a reassembled PDU]
"443  >  62984 [PSH, ACK] Seq=2721790 Ack=2592 Win=519 Len=1440 [TCP segment of a reassembled PDU]"
[TCP Fast Retransmission] 443  >  62984 [ACK] Seq=9363721 Ack=8979 Win=543 Len=1440 [TCP segment of a reassembled PDU]
Application Data
443  >  49926 Len=1200
443  >  62984 [ACK] Seq=9392521 Ack=8979 Win=543 Len=1440 [TCP segment of a reassembled PDU]
[TCP Dup ACK 16956#41] 62984  >  443 [ACK] Seq=11532 Ack=11898780 Win=4162 Len=0 SLE=11929020 SRE=11972220 SLE=11926140 SRE=11927580 SLE=11914620 SRE=11923260 SLE=11907420 SRE=11911740
62984  >  443 [ACK] Seq=5784 Ack=5867595 Win=4162 Len=0
62984  >  443 [ACK] Seq=10255 Ack=10566384 Win=4162 Len=0
443  >  62984 [ACK] Seq=7018785 Ack=6423 Win=534 Len=1440 [TCP segment of a reassembled PDU]
62984  >  443 [ACK] Seq=8979 Ack=9385321 Win=4162 Len=0
[TCP Dup ACK 13744#2] 62984  >  443 [ACK] Seq=8979 Ack=9363721 Win=4162 Len=0 SLE=9365161 SRE=9368041
"443  >  62984 [PSH, ACK] Seq=1008679 Ack=675 Win=512 Len=1440 [TCP segment of a reassembled PDU]"
"443  >  62984 [PSH, ACK] Seq=5179246 Ack=5145 Win=529 Len=1440 [TCP segment of a reassembled PDU]"
443  >  62984 [ACK] Seq=1610340 Ack=1314 Win=515 Len=1440 [TCP segment of a reassembled PDU]
"443  >  62984 [PSH, ACK] Seq=3025630 Ack=2592 Win=519 Len=1440 [TCP segment of a reassembled PDU]"
5228  >  62219 [ACK] Seq=1 Ack=2 Win=265 Len=0 SLE=1 SRE=2
443  >  62984 [ACK] Seq=7220803 Ack=7062 Win=536 Len=1440 [TCP segment of a reassembled PDU]
443  >  63586 [ACK] Seq=5287 Ack=3021 Win=16382 Len=0
62984  >  443 [ACK] Seq=36 Ack=166772 Win=4162 Len=0
443  >  62984 [ACK] Seq=5553737 Ack=5145 Win=529 Len=1440 [TCP segment of a reassembled PDU]
62984  >  443 [ACK] Seq=6423 Ack=6690231 Win=4162 Len=0 SLE=6691671 SRE=6693111
"443  >  62984 [PSH, ACK] Seq=4327687 Ack=3868 Win=524 Len=1440 [TCP segment of a reassembled PDU]"
[TCP Previous segment not captured] 443  >  62984 [ACK] Seq=2659031 Ack=2592 Win=519 Len=1440 [TCP segment of a reassembled PDU]
"443  >  62984 [PSH, ACK] Seq=13668501 Ack=13449 Win=559 Len=1440 [TCP segment of a reassembled PDU]"
62984  >  443 [ACK] Seq=3230 Ack=3472360 Win=4162 Len=0
62984  >  443 [ACK] Seq=7062 Ack=7521494 Win=4162 Len=0
443  >  62984 [ACK] Seq=2746270 Ack=2592 Win=519 Len=1440 [TCP segment of a reassembled PDU]
443  >  63410 [ACK] Seq=41 Ack=3 Win=8 Len=0
[TCP Retransmission] 443  >  62984 [ACK] Seq=8534178 Ack=8340 Win=541 Len=1440
62984  >  443 [ACK] Seq=5784 Ack=6400675 Win=4162 Len=0
[TCP Out-Of-Order] 443  >  62984 [ACK] Seq=8900498 Ack=8340 Win=541 Len=1440 [TCP segment of a reassembled PDU]
[TCP Out-Of-Order] 443  >  62984 [ACK] Seq=10455140 Ack=10255 Win=548 Len=1440 [TCP segment of a reassembled PDU]
[TCP Out-Of-Order] 443  >  62984 [ACK] Seq=12117595 Ack=11532 Win=552 Len=1440 [TCP segment of a reassembled PDU]
49926  >  443 Len=46
[TCP Retransmission] 443  >  62984 [ACK] Seq=12277078 Ack=12171 Win=555 Len=1440
62984  >  443 [ACK] Seq=10893 Ack=11162391 Win=4162 Len=0
443  >  62984 [ACK] Seq=13062281 Ack=12810 Win=557 Len=1440 [TCP segment of a reassembled PDU]
Dynamic Trunk Protocol
443  >  63649 [ACK] Seq=1 Ack=587 Win=4193792 Len=0
62984  >  443 [ACK] Seq=1953 Ack=2071574 Win=4162 Len=0 SLE=2074454 SRE=2074662
62984  >  443 [ACK] Seq=6423 Ack=6783390 Win=4162 Len=0
59152  >  443 Len=705
62984  >  443 [ACK] Seq=1314 Ack=1445927 Win=4162 Len=0 SLE=1447367 SRE=1448807
"[TCP Previous segment not captured] 443  >  62984 [PSH, ACK] Seq=8203898 Ack=7701 Win=538 Len=1440 [TCP segment of a reassembled PDU]"
[TCP Out-Of-Order] 443  >  62984 [ACK] Seq=10764230 Ack=10255 Win=548 Len=1440 [TCP segment of a reassembled PDU]
443  >  62984 [ACK] Seq=2818270 Ack=2592 Win=519 Len=1440 [TCP segment of a reassembled PDU]
443  >  62984 [ACK] Seq=4075062 Ack=3868 Win=524 Len=1440 [TCP segment of a reassembled PDU]
[TCP Dup ACK 15965#1] 62984  >  443 [ACK] Seq=10893 Ack=11086071 Win=4162 Len=0 SLE=11088951 SRE=11091831
"443  >  62984 [PSH, ACK] Seq=4125462 Ack=3868 Win=524 Len=1440 [TCP segment of a reassembled PDU]"
[TCP Out-Of-Order] 443  >  62984 [ACK] Seq=695569 Ack=675 Win=512 Len=1440 [TCP segment of a reassembled PDU]
"[TCP Previous segment not captured] 443  >  62984 [PSH, ACK] Seq=8714475 Ack=8340 Win=541 Len=1440 [TCP segment of a reassembled PDU]"
"443  >  62984 [PSH, ACK] Seq=4067862 Ack=3868 Win=524 Len=1440 [TCP segment of a reassembled PDU]"
[TCP Out-Of-Order] 443  >  62984 [ACK] Seq=9622118 Ack=9582 Win=545 Len=1440 [TCP segment of a reassembled PDU]
"443  >  62984 [PSH, ACK] Seq=13510542 Ack=13449 Win=559 Len=1440 [TCP segment of a reassembled PDU]"
62984  >  443 [ACK] Seq=5145 Ack=5550857 Win=4162 Len=0
62984  >  443 [ACK] Seq=7701 Ack=8035418 Win=4162 Len=0
62984  >  443 [ACK] Seq=1314 Ack=1477607 Win=4162 Len=0
"443  >  62984 [PSH, ACK] Seq=5010996 Ack=4506 Win=526 Len=1440 [TCP segment of a reassembled PDU]"
"443  >  62984 [PSH, ACK] Seq=9298355 Ack=8979 Win=543 Len=566 [TCP segment of a reassembled PDU]"
[TCP Out-Of-Order] 443  >  62984 [ACK] Seq=9424201 Ack=8979 Win=543 Len=1440 [TCP segment of a reassembled PDU]
62984  >  443 [ACK] Seq=3868 Ack=4264327 Win=4162 Len=0
443  >  62984 [ACK] Seq=9189064 Ack=8979 Win=543 Len=1440 [TCP segment of a reassembled PDU]
62984  >  443 [ACK] Seq=8979 Ack=9343561 Win=4162 Len=0 SLE=9345001 SRE=9346441
[TCP Out-Of-Order] 443  >  62984 [ACK] Seq=7956790 Ack=7701 Win=538 Len=1440 [TCP segment of a reassembled PDU]
49926  >  443 Len=45
443  >  62984 [ACK] Seq=11452071 Ack=10893 Win=550 Len=1440 [TCP segment of a reassembled PDU]
443  >  59720 Len=1250
64020  >  443 Len=1250
443  >  62984 [ACK] Seq=8300226 Ack=7701 Win=538 Len=1440 [TCP segment of a reassembled PDU]
443  >  49926 Len=546
"[TCP Retransmission] 443  >  62984 [PSH, ACK] Seq=8550018 Ack=8340 Win=541 Len=1440"
443  >  49926 Len=312
62984  >  443 [ACK] Seq=12810 Ack=13144361 Win=4162 Len=0
62984  >  443 [ACK] Seq=7062 Ack=7384694 Win=4162 Len=0
62984  >  443 [ACK] Seq=36 Ack=329383 Win=4162 Len=0 SLE=332263 SRE=333703
443  >  49926 Len=741
443  >  62984 [ACK] Seq=10515620 Ack=10255 Win=548 Len=1440 [TCP segment of a reassembled PDU]
443  >  49926 Len=609
443  >  62984 [ACK] Seq=4686685 Ack=4506 Win=526 Len=1440 [TCP segment of a reassembled PDU]
443  >  49926 Len=338
443  >  62984 [ACK] Seq=12621238 Ack=12171 Win=555 Len=1440 [TCP segment of a reassembled PDU]
"[TCP Previous segment not captured] 443  >  62984 [PSH, ACK] Seq=5289610 Ack=5145 Win=529 Len=1440 [TCP segment of a reassembled PDU]"
"443  >  62984 [PSH, ACK] Seq=4554721 Ack=4506 Win=526 Len=1440 [TCP segment of a reassembled PDU]"
443  >  62984 [ACK] Seq=9848426 Ack=9617 Win=545 Len=1440 [TCP segment of a reassembled PDU]
443  >  49926 Len=1200
"[TCP Previous segment not captured] 443  >  62984 [PSH, ACK] Seq=9940561 Ack=9617 Win=545 Len=1440 [TCP segment of a reassembled PDU]"
62984  >  443 [ACK] Seq=1314 Ack=1564270 Win=4162 Len=0
443  >  62984 [ACK] Seq=356743 Ack=36 Win=510 Len=1440 [TCP segment of a reassembled PDU]
[TCP Dup ACK 16956#47] 62984  >  443 [ACK] Seq=11532 Ack=11898780 Win=4162 Len=0 SLE=11929020 SRE=11980860 SLE=11926140 SRE=11927580 SLE=11914620 SRE=11923260 SLE=11907420 SRE=11911740
"443  >  62984 [PSH, ACK] Seq=13565863 Ack=13449 Win=559 Len=1440 [TCP segment of a reassembled PDU]"
"443  >  62984 [PSH, ACK] Seq=8706294 Ack=8340 Win=541 Len=1440 [TCP segment of a reassembled PDU]"
54303  >  443 Len=39
62984  >  443 [ACK] Seq=5784 Ack=5792348 Win=4162 Len=0
"443  >  62984 [PSH, ACK] Seq=13646901 Ack=13449 Win=559 Len=1440 [TCP segment of a reassembled PDU]"
[TCP Dup ACK 12219#1] 62984  >  443 [ACK] Seq=7701 Ack=8287418 Win=4162 Len=0 SLE=8290298 SRE=8291738
"443  >  62984 [PSH, ACK] Seq=8967537 Ack=8340 Win=541 Len=732 [TCP segment of a reassembled PDU]"
443  >  49926 Len=1200
62984  >  443 [ACK] Seq=4506 Ack=5000916 Win=4162 Len=0
"[TCP Previous segment not captured] 443  >  62984 [PSH, ACK] Seq=1138279 Ack=675 Win=512 Len=1440 [TCP segment of a reassembled PDU]"
443  >  62984 [ACK] Seq=13730573 Ack=13449 Win=559 Len=1440 [TCP segment of a reassembled PDU]
62984  >  443 [ACK] Seq=13449 Ack=13672821 Win=4162 Len=0
"443  >  62984 [PSH, ACK] Seq=12398038 Ack=12171 Win=555 Len=1440 [TCP segment of a reassembled PDU]"
"443  >  62984 [PSH, ACK] Seq=7321603 Ack=7062 Win=536 Len=1440 [TCP segment of a reassembled PDU]"
[TCP Out-Of-Order] 443  >  62984 [ACK] Seq=11437671 Ack=10893 Win=550 Len=1440 [TCP segment of a reassembled PDU]
62984  >  443 [ACK] Seq=6423 Ack=6861150 Win=4162 Len=0
443  >  49926 Len=1200
Application Data
62984  >  443 [ACK] Seq=1953 Ack=2350758 Win=4162 Len=0
443  >  62984 [ACK] Seq=1001479 Ack=675 Win=512 Len=1440 [TCP segment of a reassembled PDU]
55335  >  443 Len=1250
[TCP Out-Of-Order] 443  >  62984 [ACK] Seq=1944658 Ack=1953 Win=517 Len=1440 [TCP segment of a reassembled PDU]
443  >  62984 [ACK] Seq=13993051 Ack=13449 Win=559 Len=1440 [TCP segment of a reassembled PDU]
"443  >  62984 [PSH, ACK] Seq=12057115 Ack=11532 Win=552 Len=1440 [TCP segment of a reassembled PDU]"
443  >  62984 [ACK] Seq=11382951 Ack=10893 Win=550 Len=1440 [TCP segment of a reassembled PDU]
443  >  62984 [ACK] Seq=3021310 Ack=2592 Win=519 Len=1440 [TCP segment of a reassembled PDU]
[TCP Out-Of-Order] 443  >  62984 [ACK] Seq=2194182 Ack=1953 Win=517 Len=1440 [TCP segment of a reassembled PDU]
[TCP Out-Of-Order] 443  >  62984 [ACK] Seq=13214921 Ack=12810 Win=557 Len=1440 [TCP segment of a reassembled PDU]
[TCP Dup ACK 19487#19] 62984  >  443 [ACK] Seq=13449 Ack=13945531 Win=4162 Len=0 SLE=14026171 SRE=14027611 SLE=14023291 SRE=14024731 SLE=14018971 SRE=14020411 SLE=14014651 SRE=14017531
Application Data
"53  >  63659 [FIN, ACK] Seq=52 Ack=37 Win=65536 Len=0"
[TCP Out-Of-Order] 443  >  62984 [ACK] Seq=6745950 Ack=6423 Win=534 Len=1440 [TCP segment of a reassembled PDU]
[TCP Out-Of-Order] 443  >  62984 [ACK] Seq=11165271 Ack=10893 Win=550 Len=1440 [TCP segment of a reassembled PDU]
62984  >  443 [ACK] Seq=12171 Ack=12204760 Win=4162 Len=0 SLE=12206200 SRE=12216280 SLE=12222040 SRE=12223480 SLE=12217720 SRE=12219160
[TCP Out-Of-Order] 443  >  63525 [ACK] Seq=5083 Ack=2644 Win=2051 Len=1460
62984  >  443 [ACK] Seq=1953 Ack=2107782 Win=4162 Len=0
62984  >  443 [ACK] Seq=10255 Ack=10515620 Win=4162 Len=0
443  >  62984 [ACK] Seq=1867512 Ack=1314 Win=515 Len=1440 [TCP segment of a reassembled PDU]
[TCP Previous segment not captured] 443  >  62984 [ACK] Seq=8545698 Ack=8340 Win=541 Len=1440 [TCP segment of a reassembled PDU]
443  >  62984 [ACK] Seq=310663 Ack=36 Win=510 Len=1440 [TCP segment of a reassembled PDU]
53  >  63631 [ACK] Seq=1 Ack=3 Win=65536 Len=0
[TCP Out-Of-Order] 443  >  62984 [ACK] Seq=4050582 Ack=3868 Win=524 Len=1440 [TCP segment of a reassembled PDU]
"62984  >  443 [PSH, ACK] Seq=9582 Ack=9625961 Win=4162 Len=35 [TCP segment of a reassembled PDU]"
443  >  62984 [ACK] Seq=10153681 Ack=9617 Win=545 Len=1440 [TCP segment of a reassembled PDU]
63637  >  53 [SYN] Seq=0 Win=64240 Len=0 MSS=1460 WS=256 SACK_PERM
62984  >  443 [ACK] Seq=3230 Ack=3482440 Win=4162 Len=0
443  >  49926 Len=1200
RST. Root = 32768/0/34:a8:4e:07:9d:d8  Cost = 0  Port = 0x8001
62984  >  443 [ACK] Seq=2592 Ack=2857150 Win=4162 Len=0
[TCP Previous segment not captured] 443  >  62984 [ACK] Seq=731768 Ack=675 Win=512 Len=1440 [TCP segment of a reassembled PDU]
"[TCP Previous segment not captured] 443  >  62984 [PSH, ACK] Seq=8247098 Ack=7701 Win=538 Len=1440 [TCP segment of a reassembled PDU]"
443  >  62984 [ACK] Seq=11067351 Ack=10893 Win=550 Len=1440 [TCP segment of a reassembled PDU]
443  >  63638 [ACK] Seq=5649 Ack=518 Win=66816 Len=1412 [TCP segment of a reassembled PDU]
443  >  59152 Len=27
443  >  62984 [ACK] Seq=9440041 Ack=8979 Win=543 Len=1440 [TCP segment of a reassembled PDU]
[TCP Fast Retransmission] 443  >  62984 [ACK] Seq=2972350 Ack=2592 Win=519 Len=1440 [TCP segment of a reassembled PDU]
"443  >  62984 [PSH, ACK] Seq=4802196 Ack=4506 Win=526 Len=1440 [TCP segment of a reassembled PDU]"
"443  >  62984 [PSH, ACK] Seq=7816637 Ack=7701 Win=538 Len=1440 [TCP segment of a reassembled PDU]"
443  >  62984 [ACK] Seq=5046996 Ack=4506 Win=526 Len=1440 [TCP segment of a reassembled PDU]
"[TCP Retransmission] 443  >  62984 [PSH, ACK] Seq=11924700 Ack=11532 Win=552 Len=1440"
"443  >  62984 [PSH, ACK] Seq=3830114 Ack=3230 Win=522 Len=1440 [TCP segment of a reassembled PDU]"
443  >  62984 [ACK] Seq=9320521 Ack=8979 Win=543 Len=1440 [TCP segment of a reassembled PDU]
[TCP Previous segment not captured] 443  >  62984 [ACK] Seq=11684762 Ack=11532 Win=552 Len=1440 [TCP segment of a reassembled PDU]
"443  >  62984 [PSH, ACK] Seq=7841590 Ack=7701 Win=538 Len=1440 [TCP segment of a reassembled PDU]"
58506  >  443 Len=33
443  >  62984 [ACK] Seq=6415819 Ack=6388 Win=534 Len=1440 [TCP segment of a reassembled PDU]
62984  >  443 [ACK] Seq=1314 Ack=1918676 Win=4162 Len=0 SLE=1920116 SRE=1920231
62984  >  443 [ACK] Seq=7701 Ack=7854550 Win=4162 Len=0
[TCP Out-Of-Order] 443  >  62984 [ACK] Seq=10914214 Ack=10893 Win=550 Len=1440 [TCP segment of a reassembled PDU]
62984  >  443 [ACK] Seq=5784 Ack=6303613 Win=4162 Len=0 SLE=6305053 SRE=6306493
62984  >  443 [ACK] Seq=11532 Ack=11791724 Win=4162 Len=0
62984  >  443 [ACK] Seq=3230 Ack=3540674 Win=4162 Len=0 SLE=3542114 SRE=3543554
443  >  62984 [ACK] Seq=4672285 Ack=4506 Win=526 Len=1440 [TCP segment of a reassembled PDU]
"443  >  62984 [PSH, ACK] Seq=5225326 Ack=5145 Win=529 Len=1440 [TCP segment of a reassembled PDU]"
[TCP Out-Of-Order] 443  >  62984 [ACK] Seq=10525700 Ack=10255 Win=548 Len=1440 [TCP segment of a reassembled PDU]
"443  >  62984 [PSH, ACK] Seq=5093076 Ack=4506 Win=526 Len=1440 [TCP segment of a reassembled PDU]"
443  >  62984 [ACK] Seq=11897340 Ack=11532 Win=552 Len=1440 [TCP segment of a reassembled PDU]
443  >  49926 Len=24
443  >  55335 Len=24
62984  >  443 [ACK] Seq=12171 Ack=12219160 Win=4162 Len=0 SLE=12222040 SRE=12223480
"63661  >  53 [FIN, ACK] Seq=36 Ack=52 Win=131072 Len=0"
"443  >  62984 [PSH, ACK] Seq=13269641 Ack=12810 Win=557 Len=1440 [TCP segment of a reassembled PDU]"
"443  >  62984 [PSH, ACK] Seq=9734100 Ack=9617 Win=545 Len=1440 [TCP segment of a reassembled PDU]"
"443  >  62984 [PSH, ACK] Seq=11162391 Ack=10893 Win=550 Len=1440 [TCP segment of a reassembled PDU]"
443  >  62984 [ACK] Seq=12684598 Ack=12171 Win=555 Len=1440 [TCP segment of a reassembled PDU]
"443  >  62984 [PSH, ACK] Seq=5458697 Ack=5145 Win=529 Len=1440 [TCP segment of a reassembled PDU]"
443  >  58506 Len=27
63663  >  995 [ACK] Seq=303 Ack=4740 Win=130816 Len=0
443  >  62984 [ACK] Seq=14611427 Ack=14088 Win=562 Len=1440 [TCP segment of a reassembled PDU]
62984  >  443 [ACK] Seq=8340 Ack=8863058 Win=4162 Len=0
49926  >  443 Len=46
443  >  62984 [ACK] Seq=12691798 Ack=12171 Win=555 Len=1440 [TCP segment of a reassembled PDU]
62984  >  443 [ACK] Seq=7701 Ack=7759037 Win=4162 Len=0
[TCP Fast Retransmission] 443  >  62984 [ACK] Seq=12249718 Ack=12171 Win=555 Len=1440 [TCP segment of a reassembled PDU]
443  >  62984 [ACK] Seq=8180858 Ack=7701 Win=538 Len=1440 [TCP segment of a reassembled PDU]
62984  >  443 [ACK] Seq=9617 Ack=9786506 Win=4162 Len=0
443  >  64020 Len=840
