Info
62984  >  443 [ACK] Seq=12810 Ack=13167401 Win=4162 Len=0
[TCP Previous segment not captured] 443  >  62984 [ACK] Seq=1978145 Ack=1953 Win=517 Len=1440 [TCP segment of a reassembled PDU]
443  >  62984 [ACK] Seq=3805634 Ack=3230 Win=522 Len=1440 [TCP segment of a reassembled PDU]
62984  >  443 [ACK] Seq=675 Ack=1086439 Win=4162 Len=0
62984  >  443 [ACK] Seq=3230 Ack=3414760 Win=4162 Len=0
[TCP Dup ACK 17279#1] 62984  >  443 [ACK] Seq=11532 Ack=12154679 Win=4162 Len=0 SLE=12156119 SRE=12157475
62984  >  443 [ACK] Seq=4506 Ack=4990836 Win=4162 Len=0
[TCP Out-Of-Order] 443  >  62984 [ACK] Seq=9161704 Ack=8979 Win=543 Len=1440 [TCP segment of a reassembled PDU]
62984  >  443 [ACK] Seq=5784 Ack=6023995 Win=4162 Len=0
"443  >  62984 [PSH, ACK] Seq=2029677 Ack=1953 Win=517 Len=1440 [TCP segment of a reassembled PDU]"
443  >  62984 [ACK] Seq=5120436 Ack=4506 Win=526 Len=1440 [TCP segment of a reassembled PDU]
[TCP Previous segment not captured] 443  >  62984 [ACK] Seq=11926140 Ack=11532 Win=552 Len=1440 [TCP segment of a reassembled PDU]
443  >  62984 [ACK] Seq=10024081 Ack=9617 Win=545 Len=1440 [TCP segment of a reassembled PDU]
[TCP Dup ACK 15502#1] 62984  >  443 [ACK] Seq=10255 Ack=10739750 Win=4162 Len=0 SLE=10741190 SRE=10745510
443  >  62984 [ACK] Seq=11853473 Ack=11532 Win=552 Len=1440 [TCP segment of a reassembled PDU]
[TCP Previous segment not captured] 443  >  62984 [ACK] Seq=12070075 Ack=11532 Win=552 Len=1440 [TCP segment of a reassembled PDU]
443  >  62984 [ACK] Seq=4293127 Ack=3868 Win=524 Len=1440 [TCP segment of a reassembled PDU]
62984  >  443 [ACK] Seq=8340 Ack=8744914 Win=4162 Len=0 SLE=8746354 SRE=8747794
[TCP Out-Of-Order] 443  >  62984 [ACK] Seq=9258184 Ack=8979 Win=543 Len=1440 [TCP segment of a reassembled PDU]
443  >  62984 [ACK] Seq=12160355 Ack=11532 Win=552 Len=1440 [TCP segment of a reassembled PDU]
62984  >  443 [ACK] Seq=1279 Ack=1288557 Win=4162 Len=0
"443  >  62984 [PSH, ACK] Seq=3496840 Ack=3230 Win=522 Len=1440 [TCP segment of a reassembled PDU]"
62984  >  443 [ACK] Seq=5145 Ack=5286730 Win=4162 Len=0
62984  >  443 [ACK] Seq=12171 Ack=12317398 Win=4162 Len=0 SLE=12321718 SRE=12327478 SLE=12318838 SRE=12320278
[TCP Previous segment not captured] 443  >  62984 [ACK] Seq=8129018 Ack=7701 Win=538 Len=1440 [TCP segment of a reassembled PDU]
62984  >  443 [ACK] Seq=10255 Ack=10542980 Win=4162 Len=0
57338  >  443 Len=1250
443  >  62984 [ACK] Seq=2944990 Ack=2592 Win=519 Len=1440 [TCP segment of a reassembled PDU]
62984  >  443 [ACK] Seq=6423 Ack=6975169 Win=4162 Len=0 SLE=6976609 SRE=6978049
62984  >  443 [ACK] Seq=12171 Ack=12743638 Win=4162 Len=0
Application Data
443  >  62984 [ACK] Seq=3861927 Ack=3868 Win=524 Len=0
"443  >  62984 [PSH, ACK] Seq=7981270 Ack=7701 Win=538 Len=1440 [TCP segment of a reassembled PDU]"
443  >  59315 Len=22
[TCP Out-Of-Order] 443  >  62984 [ACK] Seq=741848 Ack=675 Win=512 Len=1440 [TCP segment of a reassembled PDU]
443  >  62984 [ACK] Seq=5798108 Ack=5784 Win=531 Len=1440 [TCP segment of a reassembled PDU]
[TCP Dup ACK 14516#107] 62984  >  443 [ACK] Seq=9617 Ack=9995281 Win=4162 Len=0 SLE=10073041 SRE=10166641 SLE=10067281 SRE=10068721 SLE=10012561 SRE=10065841 SLE=9999601 SRE=10008241
62984  >  443 [ACK] Seq=10255 Ack=10787270 Win=4162 Len=0
"443  >  62984 [PSH, ACK] Seq=12637078 Ack=12171 Win=555 Len=1440 [TCP segment of a reassembled PDU]"
443  >  62984 [ACK] Seq=11127831 Ack=10893 Win=550 Len=1440 [TCP segment of a reassembled PDU]
[TCP Out-Of-Order] 443  >  62984 [ACK] Seq=5364490 Ack=5145 Win=529 Len=1440 [TCP segment of a reassembled PDU]
[TCP Dup ACK 10259#1] 62984  >  443 [ACK] Seq=6423 Ack=6840990 Win=4162 Len=0 SLE=6842430 SRE=6845310
[TCP Out-Of-Order] 443  >  62984 [ACK] Seq=11709242 Ack=11532 Win=552 Len=1440 [TCP segment of a reassembled PDU]
[TCP Out-Of-Order] 443  >  62984 [ACK] Seq=7531574 Ack=7062 Win=536 Len=1440 [TCP segment of a reassembled PDU]
62984  >  443 [ACK] Seq=1314 Ack=1583814 Win=4162 Len=0
443  >  62984 [ACK] Seq=6224413 Ack=5784 Win=531 Len=1440 [TCP segment of a reassembled PDU]
443  >  58506 Len=34
"[TCP Previous segment not captured] 443  >  62984 [PSH, ACK] Seq=14011771 Ack=13449 Win=559 Len=1440 [TCP segment of a reassembled PDU]"
"443  >  62984 [PSH, ACK] Seq=4951956 Ack=4506 Win=526 Len=1440 [TCP segment of a reassembled PDU]"
62984  >  443 [ACK] Seq=1953 Ack=2184102 Win=4162 Len=0
62984  >  443 [ACK] Seq=7701 Ack=8157818 Win=4162 Len=0
[TCP Out-Of-Order] 443  >  62984 [ACK] Seq=1973825 Ack=1953 Win=517 Len=1440 [TCP segment of a reassembled PDU]
443  >  62984 [ACK] Seq=12635638 Ack=12171 Win=555 Len=1440 [TCP segment of a reassembled PDU]
"443  >  62984 [PSH, ACK] Seq=3802754 Ack=3230 Win=522 Len=1440 [TCP segment of a reassembled PDU]"
62984  >  443 [ACK] Seq=13449 Ack=13968571 Win=4162 Len=0 SLE=14029051 SRE=14034811 SLE=14026171 SRE=14027611 SLE=14023291 SRE=14024731 SLE=14018971 SRE=14020411
443  >  58506 Len=237
443  >  62984 [ACK] Seq=11726522 Ack=11532 Win=552 Len=1440 [TCP segment of a reassembled PDU]
"443  >  62984 [PSH, ACK] Seq=11675556 Ack=11532 Win=552 Len=1440 [TCP segment of a reassembled PDU]"
62984  >  443 [ACK] Seq=11532 Ack=11633429 Win=4162 Len=0 SLE=11636309 SRE=11637749
[TCP Dup ACK 3787#1] 63643  >  443 [ACK] Seq=518 Ack=1 Win=131328 Len=0 SLE=1461 SRE=2921
"443  >  62984 [PSH, ACK] Seq=9898602 Ack=9617 Win=545 Len=1312 [TCP segment of a reassembled PDU]"
[TCP Previous segment not captured] 443  >  62984 [ACK] Seq=997159 Ack=675 Win=512 Len=1440 [TCP segment of a reassembled PDU]
[TCP Dup ACK 5682#1] 62984  >  443 [ACK] Seq=3230 Ack=3515560 Win=4162 Len=0 SLE=3517000 SRE=3517413
62984  >  443 [ACK] Seq=10893 Ack=11188311 Win=4162 Len=0 SLE=11189751 SRE=11191191
443  >  59152 Len=77
"443  >  62984 [PSH, ACK] Seq=13536462 Ack=13449 Win=559 Len=1440 [TCP segment of a reassembled PDU]"
62984  >  443 [ACK] Seq=6423 Ack=6705630 Win=4162 Len=0 SLE=6708510 SRE=6709950
"443  >  62984 [PSH, ACK] Seq=14700707 Ack=14088 Win=562 Len=1440 [TCP segment of a reassembled PDU]"
"443  >  62984 [PSH, ACK] Seq=14208489 Ack=14088 Win=562 Len=1440 [TCP segment of a reassembled PDU]"
443  >  62984 [ACK] Seq=7515734 Ack=7062 Win=536 Len=1440 [TCP segment of a reassembled PDU]
62984  >  443 [ACK] Seq=9617 Ack=10258341 Win=4162 Len=0
443  >  62984 [ACK] Seq=169652 Ack=36 Win=510 Len=1440 [TCP segment of a reassembled PDU]
443  >  62984 [ACK] Seq=2500518 Ack=1953 Win=517 Len=1440 [TCP segment of a reassembled PDU]
"443  >  62984 [PSH, ACK] Seq=6041275 Ack=5784 Win=531 Len=1440 [TCP segment of a reassembled PDU]"
62984  >  443 [ACK] Seq=1314 Ack=1833260 Win=4162 Len=0 SLE=1834700 SRE=1836140
62984  >  443 [ACK] Seq=8979 Ack=9422761 Win=4162 Len=0
62984  >  443 [ACK] Seq=14088 Ack=14638787 Win=4162 Len=0
62984  >  443 [ACK] Seq=1314 Ack=1448807 Win=4162 Len=0
[TCP Dup ACK 1453#59] 62984  >  443 [ACK] Seq=675 Ack=1136839 Win=4162 Len=0 SLE=1214599 SRE=1233319 SLE=1236199 SRE=1237639 SLE=1190119 SRE=1213159 SLE=1180039 SRE=1188679
443  >  62984 [ACK] Seq=1702500 Ack=1314 Win=515 Len=1440 [TCP segment of a reassembled PDU]
"443  >  62984 [PSH, ACK] Seq=14565347 Ack=14088 Win=562 Len=1440 [TCP segment of a reassembled PDU]"
"443  >  62984 [PSH, ACK] Seq=1493447 Ack=1314 Win=515 Len=1440 [TCP segment of a reassembled PDU]"
443  >  62984 [ACK] Seq=4251367 Ack=3868 Win=524 Len=1440 [TCP segment of a reassembled PDU]
[TCP Dup ACK 14516#118] 62984  >  443 [ACK] Seq=9617 Ack=9995281 Win=4162 Len=0 SLE=10073041 SRE=10182481 SLE=10067281 SRE=10068721 SLE=10012561 SRE=10065841 SLE=9999601 SRE=10008241
62984  >  443 [ACK] Seq=13449 Ack=13619541 Win=4162 Len=0
"443  >  62984 [PSH, ACK] Seq=1920231 Ack=1314 Win=515 Len=31 [TCP segment of a reassembled PDU]"
443  >  62984 [ACK] Seq=11806690 Ack=11532 Win=552 Len=1440 [TCP segment of a reassembled PDU]
62984  >  443 [ACK] Seq=3868 Ack=3882087 Win=4162 Len=0
62984  >  443 [ACK] Seq=1953 Ack=2311878 Win=4162 Len=0
443  >  62984 [ACK] Seq=671724 Ack=675 Win=512 Len=1440 [TCP segment of a reassembled PDU]
443  >  62984 [ACK] Seq=4835316 Ack=4506 Win=526 Len=1440 [TCP segment of a reassembled PDU]
62984  >  443 [ACK] Seq=36 Ack=137406 Win=4162 Len=0
[TCP Out-Of-Order] 443  >  62984 [ACK] Seq=6647635 Ack=6423 Win=534 Len=1440 [TCP segment of a reassembled PDU]
443  >  49926 Len=1200
[TCP Dup ACK 1850#2] 62984  >  443 [ACK] Seq=1314 Ack=1358568 Win=4162 Len=0 SLE=1360008 SRE=1362888
"[TCP Previous segment not captured] 443  >  62984 [PSH, ACK] Seq=12816789 Ack=12775 Win=557 Len=294 [TCP segment of a reassembled PDU]"
443  >  62984 [ACK] Seq=7560374 Ack=7062 Win=536 Len=1440 [TCP segment of a reassembled PDU]
63661  >  53 [ACK] Seq=1 Ack=1 Win=131072 Len=0
[TCP Previous segment not captured] 443  >  62984 [ACK] Seq=10788710 Ack=10255 Win=548 Len=1440 [TCP segment of a reassembled PDU]
[TCP Dup ACK 1453#3] 62984  >  443 [ACK] Seq=675 Ack=1136839 Win=4162 Len=0 SLE=1138279 SRE=1142599
[TCP Previous segment not captured] 443  >  62984 [ACK] Seq=11775461 Ack=11532 Win=552 Len=1440 [TCP segment of a reassembled PDU]
62984  >  443 [ACK] Seq=9617 Ack=10203272 Win=4162 Len=0
62984  >  443 [ACK] Seq=3230 Ack=3724994 Win=4162 Len=0
[TCP Out-Of-Order] 443  >  62984 [ACK] Seq=10853510 Ack=10255 Win=548 Len=1440 [TCP segment of a reassembled PDU]
[TCP Dup ACK 1925#1] 62984  >  443 [ACK] Seq=1314 Ack=1413473 Win=4162 Len=0 SLE=1417793 SRE=1418359
"443  >  62984 [PSH, ACK] Seq=3423400 Ack=3230 Win=522 Len=1440 [TCP segment of a reassembled PDU]"
62984  >  443 [ACK] Seq=5784 Ack=6162493 Win=4162 Len=0
62984  >  443 [ACK] Seq=12810 Ack=13240841 Win=4162 Len=0
443  >  64020 Len=628
[TCP Out-Of-Order] 443  >  62984 [ACK] Seq=12981641 Ack=12810 Win=557 Len=1440 [TCP segment of a reassembled PDU]
443  >  49926 Len=1185
"443  >  62984 [PSH, ACK] Seq=4904436 Ack=4506 Win=526 Len=1440 [TCP segment of a reassembled PDU]"
53  >  63655 [ACK] Seq=1 Ack=3 Win=65536 Len=0
443  >  62984 [ACK] Seq=8439199 Ack=8340 Win=541 Len=1440 [TCP segment of a reassembled PDU]
"[TCP Previous segment not captured] 443  >  62984 [PSH, ACK] Seq=10093201 Ack=9617 Win=545 Len=1440 [TCP segment of a reassembled PDU]"
443  >  62984 [ACK] Seq=3368680 Ack=3230 Win=522 Len=1440 [TCP segment of a reassembled PDU]
62984  >  443 [ACK] Seq=4506 Ack=4675165 Win=4162 Len=0
443  >  62984 [ACK] Seq=12726358 Ack=12171 Win=555 Len=1440 [TCP segment of a reassembled PDU]
62984  >  443 [ACK] Seq=8340 Ack=8478494 Win=4162 Len=0
Application Data
58506  >  443 Len=423
"443  >  62984 [PSH, ACK] Seq=5543657 Ack=5145 Win=529 Len=1440 [TCP segment of a reassembled PDU]"
62984  >  443 [ACK] Seq=5784 Ack=6148093 Win=4162 Len=0
RST. Root = 32768/0/34:a8:4e:07:9d:d8  Cost = 0  Port = 0x8001
[TCP Dup ACK 16956#58] 62984  >  443 [ACK] Seq=11532 Ack=11898780 Win=4162 Len=0 SLE=11929020 SRE=12002460 SLE=11926140 SRE=11927580 SLE=11914620 SRE=11923260 SLE=11907420 SRE=11911740
[TCP Fast Retransmission] 443  >  62984 [ACK] Seq=2613825 Ack=2592 Win=519 Len=1440 [TCP segment of a reassembled PDU]
443  >  62984 [ACK] Seq=14507747 Ack=14088 Win=562 Len=1440 [TCP segment of a reassembled PDU]
"443  >  62984 [PSH, ACK] Seq=13820251 Ack=13449 Win=559 Len=1440 [TCP segment of a reassembled PDU]"
62984  >  443 [ACK] Seq=1314 Ack=1543544 Win=4162 Len=0
62984  >  443 [ACK] Seq=8340 Ack=8464094 Win=4162 Len=0
"443  >  62984 [PSH, ACK] Seq=4418407 Ack=3868 Win=524 Len=1440 [TCP segment of a reassembled PDU]"
58506  >  443 Len=1250
443  >  62984 [ACK] Seq=10427780 Ack=10255 Win=548 Len=1440 [TCP segment of a reassembled PDU]
443  >  62984 [ACK] Seq=12843003 Ack=12810 Win=557 Len=1440 [TCP segment of a reassembled PDU]
[TCP Out-Of-Order] 443  >  62984 [ACK] Seq=10615910 Ack=10255 Win=548 Len=1440 [TCP segment of a reassembled PDU]
"443  >  62984 [PSH, ACK] Seq=11761082 Ack=11532 Win=552 Len=1440 [TCP segment of a reassembled PDU]"
[TCP Keep-Alive ACK] 443  >  63129 [ACK] Seq=1 Ack=2 Win=408 Len=0 SLE=1 SRE=2
62984  >  443 [ACK] Seq=13414 Ack=13454433 Win=4162 Len=0
"443  >  62984 [PSH, ACK] Seq=10892665 Ack=10255 Win=548 Len=31 [TCP segment of a reassembled PDU]"
[TCP Dup ACK 12105#1] 62984  >  443 [ACK] Seq=7701 Ack=8192378 Win=4162 Len=0 SLE=8193818 SRE=8196698
58506  >  443 Len=33
443  >  62984 [ACK] Seq=14442947 Ack=14088 Win=562 Len=1440 [TCP segment of a reassembled PDU]
443  >  62984 [ACK] Seq=657324 Ack=675 Win=512 Len=1440 [TCP segment of a reassembled PDU]
[TCP Out-Of-Order] 443  >  62984 [ACK] Seq=774968 Ack=675 Win=512 Len=1440 [TCP segment of a reassembled PDU]
443  >  58506 Len=25
443  >  49926 Len=947
"443  >  62984 [PSH, ACK] Seq=1836140 Ack=1314 Win=515 Len=566 [TCP segment of a reassembled PDU]"
59152  >  443 Len=29
443  >  62984 [ACK] Seq=4425607 Ack=3868 Win=524 Len=1440 [TCP segment of a reassembled PDU]
62984  >  443 [ACK] Seq=11532 Ack=11598303 Win=4162 Len=0
"53  >  63665 [FIN, ACK] Seq=202 Ack=43 Win=65536 Len=0"
443  >  62984 [ACK] Seq=10927046 Ack=10893 Win=550 Len=1440 [TCP segment of a reassembled PDU]
443  >  62984 [ACK] Seq=1549870 Ack=1314 Win=515 Len=1440 [TCP segment of a reassembled PDU]
[TCP Previous segment not captured] 443  >  62984 [ACK] Seq=2573143 Ack=2557 Win=519 Len=1440 [TCP segment of a reassembled PDU]
"443  >  62984 [PSH, ACK] Seq=13255241 Ack=12810 Win=557 Len=1440 [TCP segment of a reassembled PDU]"
Application Data
[TCP Previous segment not captured] 443  >  62984 [ACK] Seq=2440038 Ack=1953 Win=517 Len=1440 [TCP segment of a reassembled PDU]
62984  >  443 [ACK] Seq=675 Ack=754808 Win=4162 Len=0
62984  >  443 [ACK] Seq=5784 Ack=6153853 Win=4162 Len=0
62984  >  443 [ACK] Seq=13449 Ack=13792891 Win=4162 Len=0
[TCP Previous segment not captured] 443  >  62984 [ACK] Seq=12098875 Ack=11532 Win=552 Len=1440 [TCP segment of a reassembled PDU]
[TCP Dup ACK 16956#23] 62984  >  443 [ACK] Seq=11532 Ack=11898780 Win=4162 Len=0 SLE=11929020 SRE=11946300 SLE=11926140 SRE=11927580 SLE=11914620 SRE=11923260 SLE=11907420 SRE=11911740
62984  >  443 [ACK] Seq=5145 Ack=5304010 Win=4162 Len=0
443  >  62984 [ACK] Seq=5145706 Ack=5145 Win=529 Len=1440 [TCP segment of a reassembled PDU]
[TCP Previous segment not captured] 443  >  62984 [ACK] Seq=697009 Ack=675 Win=512 Len=1440 [TCP segment of a reassembled PDU]
443  >  62984 [ACK] Seq=5835915 Ack=5784 Win=531 Len=1440 [TCP segment of a reassembled PDU]
Application Data
62984  >  443 [ACK] Seq=12810 Ack=13333001 Win=4162 Len=0
[TCP Dup ACK 1343#1] 62984  >  443 [ACK] Seq=675 Ack=1044679 Win=4162 Len=0 SLE=1047559 SRE=1048999
49926  >  443 Len=46
443  >  62984 [ACK] Seq=287424 Ack=36 Win=510 Len=1440 [TCP segment of a reassembled PDU]
[TCP Out-Of-Order] 443  >  62984 [ACK] Seq=9038402 Ack=8979 Win=543 Len=1440 [TCP segment of a reassembled PDU]
"[TCP Previous segment not captured] 443  >  62984 [PSH, ACK] Seq=13620981 Ack=13449 Win=559 Len=1440 [TCP segment of a reassembled PDU]"
[TCP Dup ACK 955#1] 62984  >  443 [ACK] Seq=675 Ack=710168 Win=4162 Len=0 SLE=713048 SRE=714488
58506  >  443 Len=36
443  >  62984 [ACK] Seq=879657 Ack=675 Win=512 Len=1440 [TCP segment of a reassembled PDU]
[TCP Out-Of-Order] 443  >  62984 [ACK] Seq=1976705 Ack=1953 Win=517 Len=1440 [TCP segment of a reassembled PDU]
443  >  62984 [ACK] Seq=1516487 Ack=1314 Win=515 Len=1440 [TCP segment of a reassembled PDU]
443  >  62984 [ACK] Seq=1519367 Ack=1314 Win=515 Len=1440 [TCP segment of a reassembled PDU]
49926  >  443 Len=46
62984  >  443 [ACK] Seq=3868 Ack=4099542 Win=4162 Len=0
49926  >  443 Len=45
62984  >  443 [ACK] Seq=10893 Ack=11453511 Win=4162 Len=0
443  >  62984 [ACK] Seq=13197641 Ack=12810 Win=557 Len=1440 [TCP segment of a reassembled PDU]
[TCP Dup ACK 9394#1] 62984  >  443 [ACK] Seq=5784 Ack=6150973 Win=4162 Len=0 SLE=6152413 SRE=6153853
443  >  49926 Len=735
"[TCP Out-Of-Order] 443  >  62528 [PSH, ACK] Seq=22118 Ack=9127 Win=924 Len=256"
62984  >  443 [ACK] Seq=12810 Ack=13397801 Win=4162 Len=0
443  >  62984 [ACK] Seq=9401161 Ack=8979 Win=543 Len=1440 [TCP segment of a reassembled PDU]
[TCP Previous segment not captured] 443  >  62984 [ACK] Seq=11636309 Ack=11532 Win=552 Len=1440 [TCP segment of a reassembled PDU]
443  >  62984 [ACK] Seq=3252162 Ack=3230 Win=522 Len=1440 [TCP segment of a reassembled PDU]
"443  >  62984 [PSH, ACK] Seq=3416200 Ack=3230 Win=522 Len=1440 [TCP segment of a reassembled PDU]"
[TCP Out-Of-Order] 443  >  62984 [ACK] Seq=11106231 Ack=10893 Win=550 Len=1440 [TCP segment of a reassembled PDU]
62984  >  443 [ACK] Seq=12171 Ack=12524758 Win=4162 Len=0
62984  >  443 [ACK] Seq=1953 Ack=2556678 Win=4162 Len=0 SLE=2560998 SRE=2561623
62984  >  443 [ACK] Seq=6423 Ack=6490279 Win=4162 Len=0
49926  >  443 Len=45
[TCP Previous segment not captured] 443  >  62984 [ACK] Seq=14080891 Ack=13449 Win=559 Len=1440 [TCP segment of a reassembled PDU]
62984  >  443 [ACK] Seq=10893 Ack=11358471 Win=4162 Len=0 SLE=11362791 SRE=11364231
"443  >  62984 [PSH, ACK] Seq=13184681 Ack=12810 Win=557 Len=1440 [TCP segment of a reassembled PDU]"
62984  >  443 [ACK] Seq=12171 Ack=12513238 Win=4162 Len=0
[TCP Out-Of-Order] 443  >  62984 [ACK] Seq=6923070 Ack=6423 Win=534 Len=1440 [TCP segment of a reassembled PDU]
443  >  62984 [ACK] Seq=14155209 Ack=14088 Win=562 Len=1440 [TCP segment of a reassembled PDU]
443  >  62984 [ACK] Seq=7890550 Ack=7701 Win=538 Len=1440 [TCP segment of a reassembled PDU]
"443  >  62984 [PSH, ACK] Seq=13289801 Ack=12810 Win=557 Len=1440 [TCP segment of a reassembled PDU]"
[TCP Previous segment not captured] 443  >  62984 [ACK] Seq=9389641 Ack=8979 Win=543 Len=1440 [TCP segment of a reassembled PDU]
[TCP Out-Of-Order] 443  >  62984 [ACK] Seq=8551458 Ack=8340 Win=541 Len=1440 [TCP segment of a reassembled PDU]
49926  >  443 Len=45
[TCP Previous segment not captured] 443  >  62984 [ACK] Seq=1797540 Ack=1314 Win=515 Len=1440 [TCP segment of a reassembled PDU]
"443  >  62984 [PSH, ACK] Seq=5113236 Ack=4506 Win=526 Len=1440 [TCP segment of a reassembled PDU]"
"443  >  62984 [PSH, ACK] Seq=5396406 Ack=5145 Win=529 Len=1440 [TCP segment of a reassembled PDU]"
63650  >  53 [SYN] Seq=0 Win=64240 Len=0 MSS=1460 WS=256 SACK_PERM
443  >  58506 Len=47
443  >  62984 [ACK] Seq=9103202 Ack=8979 Win=543 Len=1440 [TCP segment of a reassembled PDU]
443  >  62984 [ACK] Seq=13840411 Ack=13449 Win=559 Len=1440 [TCP segment of a reassembled PDU]
62984  >  443 [ACK] Seq=7062 Ack=7085553 Win=4162 Len=0
[TCP Out-Of-Order] 443  >  62984 [ACK] Seq=6789150 Ack=6423 Win=534 Len=1440 [TCP segment of a reassembled PDU]
62984  >  443 [ACK] Seq=9617 Ack=9774986 Win=4162 Len=0
"443  >  62984 [PSH, ACK] Seq=11391591 Ack=10893 Win=550 Len=1440 [TCP segment of a reassembled PDU]"
62984  >  443 [ACK] Seq=3230 Ack=3637154 Win=4162 Len=0
443  >  62984 [ACK] Seq=2494758 Ack=1953 Win=517 Len=1440 [TCP segment of a reassembled PDU]
[TCP Out-Of-Order] 443  >  62984 [ACK] Seq=9599881 Ack=8979 Win=543 Len=1440 [TCP segment of a reassembled PDU]
"443  >  62984 [PSH, ACK] Seq=13410761 Ack=12810 Win=557 Len=1440 [TCP segment of a reassembled PDU]"
443  >  63586 [ACK] Seq=1742 Ack=1137 Win=16383 Len=0
[TCP Dup ACK 101#1] 62984  >  443 [ACK] Seq=36 Ack=73679 Win=4162 Len=0 SLE=75119 SRE=77999
[TCP Dup ACK 18997#1] 62984  >  443 [ACK] Seq=13449 Ack=13575943 Win=4162 Len=0 SLE=13577383 SRE=13578823
55662  >  443 Len=33
Standard query response 0xba73 HTTPS play.google.com SOA ns1.google.com
[TCP Dup ACK 9047#1] 62984  >  443 [ACK] Seq=5784 Ack=5833035 Win=4162 Len=0 SLE=5834475 SRE=5835915
Standard query response 0x9d9a A www.bing.com CNAME www-www.bing.com.trafficmanager.net CNAME www-bing-com.dual-a-0001.a-msedge.net CNAME dual-a-0001.a-msedge.net A 204.79.197.200 A 13.107.21.200
"443  >  62984 [PSH, ACK] Seq=8721675 Ack=8340 Win=541 Len=1440 [TCP segment of a reassembled PDU]"
443  >  62984 [ACK] Seq=6178333 Ack=5784 Win=531 Len=1440 [TCP segment of a reassembled PDU]
"443  >  62984 [PSH, ACK] Seq=6153853 Ack=5784 Win=531 Len=1440 [TCP segment of a reassembled PDU]"
62984  >  443 [ACK] Seq=12810 Ack=13191881 Win=4162 Len=0
443  >  61183 Len=812
443  >  62984 [ACK] Seq=13127081 Ack=12810 Win=557 Len=1440 [TCP segment of a reassembled PDU]
443  >  62984 [ACK] Seq=8958897 Ack=8340 Win=541 Len=1440 [TCP segment of a reassembled PDU]
"[TCP Previous segment not captured] 443  >  62984 [PSH, ACK] Seq=14536547 Ack=14088 Win=562 Len=1440 [TCP segment of a reassembled PDU]"
[TCP Dup ACK 515#2] 62984  >  443 [ACK] Seq=36 Ack=420103 Win=4162 Len=0 SLE=428743 SRE=430183 SLE=425863 SRE=427303
62984  >  443 [ACK] Seq=10893 Ack=11470791 Win=4162 Len=0
"[TCP Previous segment not captured] 443  >  62984 [PSH, ACK] Seq=4105302 Ack=3868 Win=524 Len=1440 [TCP segment of a reassembled PDU]"
443  >  62984 [ACK] Seq=8163578 Ack=7701 Win=538 Len=1440 [TCP segment of a reassembled PDU]
"443  >  62984 [PSH, ACK] Seq=10726790 Ack=10255 Win=548 Len=1440 [TCP segment of a reassembled PDU]"
443  >  62984 [ACK] Seq=1765860 Ack=1314 Win=515 Len=1440 [TCP segment of a reassembled PDU]
443  >  49926 Len=1200
62984  >  443 [ACK] Seq=675 Ack=698449 Win=4162 Len=0
443  >  62984 [ACK] Seq=9232264 Ack=8979 Win=543 Len=1440 [TCP segment of a reassembled PDU]
62984  >  443 [ACK] Seq=9617 Ack=10206152 Win=4162 Len=0
443  >  62984 [ACK] Seq=12367798 Ack=12171 Win=555 Len=1440 [TCP segment of a reassembled PDU]
Application Data
[TCP Dup ACK 7730#1] 62984  >  443 [ACK] Seq=4506 Ack=4815156 Win=4162 Len=0 SLE=4816596 SRE=4818036
[TCP Out-Of-Order] 443  >  62984 [ACK] Seq=4701085 Ack=4506 Win=526 Len=1440 [TCP segment of a reassembled PDU]
62984  >  443 [ACK] Seq=8340 Ack=8933618 Win=4162 Len=0
[TCP Out-Of-Order] 443  >  62984 [ACK] Seq=6690231 Ack=6423 Win=534 Len=1440 [TCP segment of a reassembled PDU]
443  >  62984 [ACK] Seq=2119302 Ack=1953 Win=517 Len=1440 [TCP segment of a reassembled PDU]
443  >  62984 [ACK] Seq=9823946 Ack=9617 Win=545 Len=1440 [TCP segment of a reassembled PDU]
443  >  62984 [ACK] Seq=11527449 Ack=11497 Win=552 Len=1440 [TCP segment of a reassembled PDU]
443  >  62984 [ACK] Seq=932937 Ack=675 Win=512 Len=1440 [TCP segment of a reassembled PDU]
[TCP Dup ACK 14516#53] 62984  >  443 [ACK] Seq=9617 Ack=9995281 Win=4162 Len=0 SLE=10073041 SRE=10088881 SLE=10067281 SRE=10068721 SLE=10012561 SRE=10065841 SLE=9999601 SRE=10008241
443  >  62984 [ACK] Seq=822057 Ack=675 Win=512 Len=1440 [TCP segment of a reassembled PDU]
"443  >  62984 [PSH, ACK] Seq=14432867 Ack=14088 Win=562 Len=1440 [TCP segment of a reassembled PDU]"
62984  >  443 [ACK] Seq=5784 Ack=6114973 Win=4162 Len=0
"443  >  62984 [PSH, ACK] Seq=3539234 Ack=3230 Win=522 Len=1440 [TCP segment of a reassembled PDU]"
443  >  62984 [ACK] Seq=6326653 Ack=5784 Win=531 Len=1440 [TCP segment of a reassembled PDU]
"443  >  62984 [PSH, ACK] Seq=7131982 Ack=7062 Win=536 Len=1440 [TCP segment of a reassembled PDU]"
"443  >  62984 [PSH, ACK] Seq=4974996 Ack=4506 Win=526 Len=1440 [TCP segment of a reassembled PDU]"
63645  >  53 [SYN] Seq=0 Win=64240 Len=0 MSS=1460 WS=256 SACK_PERM
[TCP Out-Of-Order] 443  >  62984 [ACK] Seq=7169422 Ack=7062 Win=536 Len=1440 [TCP segment of a reassembled PDU]
443  >  62984 [ACK] Seq=14382638 Ack=14088 Win=562 Len=1440 [TCP segment of a reassembled PDU]
"443  >  62984 [PSH, ACK] Seq=2346438 Ack=1953 Win=517 Len=1440 [TCP segment of a reassembled PDU]"
62984  >  443 [ACK] Seq=675 Ack=1025959 Win=4162 Len=0
443  >  62984 [ACK] Seq=1289997 Ack=1279 Win=515 Len=1440 [TCP segment of a reassembled PDU]
[TCP Dup ACK 4356#8] 62984  >  443 [ACK] Seq=2592 Ack=2957950 Win=4162 Len=0 SLE=2975230 SRE=2978110 SLE=2960830 SRE=2972350
62984  >  443 [ACK] Seq=6423 Ack=6500359 Win=4162 Len=0
443  >  62984 [ACK] Seq=8481374 Ack=8340 Win=541 Len=1440 [TCP segment of a reassembled PDU]
55335  >  443 Len=32
62984  >  443 [ACK] Seq=1953 Ack=2516358 Win=4162 Len=0
[TCP Out-Of-Order] 443  >  62984 [ACK] Seq=96719 Ack=36 Win=510 Len=1440 [TCP segment of a reassembled PDU]
[TCP Out-Of-Order] 443  >  62984 [ACK] Seq=14036251 Ack=13449 Win=559 Len=1440 [TCP segment of a reassembled PDU]
[TCP Dup ACK 16956#74] 62984  >  443 [ACK] Seq=11532 Ack=11898780 Win=4162 Len=0 SLE=11929020 SRE=12025500 SLE=11926140 SRE=11927580 SLE=11914620 SRE=11923260 SLE=11907420 SRE=11911740
"63662  >  53 [FIN, ACK] Seq=36 Ack=86 Win=131072 Len=0"
49926  >  443 Len=45
443  >  62984 [ACK] Seq=11843022 Ack=11532 Win=552 Len=1440 [TCP segment of a reassembled PDU]
443  >  62984 [ACK] Seq=9368041 Ack=8979 Win=543 Len=1440 [TCP segment of a reassembled PDU]
[TCP Dup ACK 1822#1] 62984  >  443 [ACK] Seq=1314 Ack=1334922 Win=4162 Len=0 SLE=1336362 SRE=1337802
[TCP Dup ACK 12821#1] 62984  >  443 [ACK] Seq=8340 Ack=8733394 Win=4162 Len=0 SLE=8737714 SRE=8739154
62984  >  443 [ACK] Seq=7701 Ack=7732334 Win=4162 Len=0
"443  >  62984 [PSH, ACK] Seq=10782950 Ack=10255 Win=548 Len=1440 [TCP segment of a reassembled PDU]"
62984  >  443 [ACK] Seq=8979 Ack=9184744 Win=4162 Len=0
"443  >  62984 [PSH, ACK] Seq=11230090 Ack=10893 Win=550 Len=1440 [TCP segment of a reassembled PDU]"
"[TCP Previous segment not captured] 443  >  62984 [PSH, ACK] Seq=3074590 Ack=2592 Win=519 Len=1440 [TCP segment of a reassembled PDU]"
[TCP Dup ACK 18905#1] 62984  >  443 [ACK] Seq=13449 Ack=13490632 Win=4162 Len=0 SLE=13492072 SRE=13493512
62984  >  443 [ACK] Seq=2592 Ack=2993950 Win=4162 Len=0 SLE=2995390 SRE=3022750
443  >  62984 [ACK] Seq=1649220 Ack=1314 Win=515 Len=1440 [TCP segment of a reassembled PDU]
443  >  62984 [ACK] Seq=2013837 Ack=1953 Win=517 Len=1440 [TCP segment of a reassembled PDU]
62984  >  443 [ACK] Seq=10893 Ack=10914214 Win=4162 Len=0 SLE=10915654 SRE=10917094
"443  >  62984 [PSH, ACK] Seq=4892916 Ack=4506 Win=526 Len=1440 [TCP segment of a reassembled PDU]"
49926  >  443 Len=45
[TCP Dup ACK 4475#16] 62984  >  443 [ACK] Seq=2592 Ack=3052990 Win=4162 Len=0 SLE=3054430 SRE=3080350
[TCP Dup ACK 16956#42] 62984  >  443 [ACK] Seq=11532 Ack=11898780 Win=4162 Len=0 SLE=11975100 SRE=11976540 SLE=11929020 SRE=11972220 SLE=11926140 SRE=11927580 SLE=11914620 SRE=11923260
443  >  62984 [ACK] Seq=6148093 Ack=5784 Win=531 Len=1440 [TCP segment of a reassembled PDU]
443  >  62984 [ACK] Seq=3385960 Ack=3230 Win=522 Len=1440 [TCP segment of a reassembled PDU]
[TCP Out-Of-Order] 443  >  62984 [ACK] Seq=4787485 Ack=4506 Win=526 Len=1440 [TCP segment of a reassembled PDU]
[TCP Previous segment not captured] 443  >  62984 [ACK] Seq=2634551 Ack=2592 Win=519 Len=1440 [TCP segment of a reassembled PDU]
"53  >  63662 [FIN, ACK] Seq=86 Ack=37 Win=65536 Len=0"
[TCP Previous segment not captured] 443  >  62984 [ACK] Seq=6667920 Ack=6423 Win=534 Len=1440 [TCP segment of a reassembled PDU]
49926  >  443 Len=46
443  >  62984 [ACK] Seq=10015441 Ack=9617 Win=545 Len=1440 [TCP segment of a reassembled PDU]
443  >  62984 [ACK] Seq=9278344 Ack=8979 Win=543 Len=1440 [TCP segment of a reassembled PDU]
62984  >  443 [ACK] Seq=1953 Ack=2208582 Win=4162 Len=0
443  >  62984 [ACK] Seq=13965691 Ack=13449 Win=559 Len=1440 [TCP segment of a reassembled PDU]
62984  >  443 [ACK] Seq=3868 Ack=4369447 Win=4162 Len=0
[TCP Dup ACK 14516#28] 62984  >  443 [ACK] Seq=9617 Ack=9995281 Win=4162 Len=0 SLE=10012561 SRE=10045681 SLE=9999601 SRE=10008241 SLE=9996721 SRE=9998161
[TCP Previous segment not captured] 443  >  62984 [ACK] Seq=372583 Ack=36 Win=510 Len=1440 [TCP segment of a reassembled PDU]
[TCP Fast Retransmission] 443  >  62984 [ACK] Seq=1683780 Ack=1314 Win=515 Len=1440 [TCP segment of a reassembled PDU]
443  >  62984 [ACK] Seq=7042391 Ack=6423 Win=534 Len=1440 [TCP segment of a reassembled PDU]
443  >  62984 [ACK] Seq=8033978 Ack=7701 Win=538 Len=1440 [TCP segment of a reassembled PDU]
62984  >  443 [ACK] Seq=14088 Ack=14189769 Win=4162 Len=0
443  >  62984 [ACK] Seq=13282601 Ack=12810 Win=557 Len=1440 [TCP segment of a reassembled PDU]
62984  >  443 [ACK] Seq=10893 Ack=10970971 Win=4162 Len=0 SLE=10972411 SRE=10973851
443  >  49926 Len=850
443  >  62984 [ACK] Seq=437383 Ack=36 Win=510 Len=1440 [TCP segment of a reassembled PDU]
443  >  62984 [ACK] Seq=8291738 Ack=7701 Win=538 Len=1440 [TCP segment of a reassembled PDU]
62984  >  443 [ACK] Seq=5784 Ack=6063133 Win=4162 Len=0
443  >  62984 [ACK] Seq=1346442 Ack=1314 Win=515 Len=1440 [TCP segment of a reassembled PDU]
[TCP Out-Of-Order] 443  >  62984 [ACK] Seq=10109041 Ack=9617 Win=545 Len=1440 [TCP segment of a reassembled PDU]
"443  >  62984 [PSH, ACK] Seq=5136764 Ack=5110 Win=529 Len=1440 [TCP segment of a reassembled PDU]"
"443  >  62984 [PSH, ACK] Seq=11473671 Ack=10893 Win=550 Len=1440 [TCP segment of a reassembled PDU]"
"443  >  62984 [PSH, ACK] Seq=9855626 Ack=9617 Win=545 Len=1440 [TCP segment of a reassembled PDU]"
62984  >  443 [ACK] Seq=12171 Ack=12765238 Win=4162 Len=0
443  >  62984 [ACK] Seq=1390814 Ack=1314 Win=515 Len=1440 [TCP segment of a reassembled PDU]
443  >  59720 Len=26
[TCP Out-Of-Order] 443  >  62984 [ACK] Seq=5598377 Ack=5145 Win=529 Len=1440 [TCP segment of a reassembled PDU]
"63632  >  53 [FIN, ACK] Seq=40 Ack=56 Win=131072 Len=0"
"443  >  62984 [PSH, ACK] Seq=8926418 Ack=8340 Win=541 Len=1440 [TCP segment of a reassembled PDU]"
[TCP Dup ACK 12544#13] 62984  >  443 [ACK] Seq=8340 Ack=8524098 Win=4162 Len=0 SLE=8551458 SRE=8558658 SLE=8545698 SRE=8547138 SLE=8537058 SRE=8544258 SLE=8529858 SRE=8534178
[TCP Out-Of-Order] 443  >  62984 [ACK] Seq=10047121 Ack=9617 Win=545 Len=1440 [TCP segment of a reassembled PDU]
443  >  62984 [ACK] Seq=7574774 Ack=7062 Win=536 Len=1440 [TCP segment of a reassembled PDU]
62984  >  443 [ACK] Seq=1314 Ack=1838146 Win=4162 Len=0 SLE=1839586 SRE=1841026
62984  >  443 [ACK] Seq=10893 Ack=10969531 Win=4162 Len=0 SLE=10972411 SRE=10973851
443  >  62984 [ACK] Seq=8575938 Ack=8340 Win=541 Len=1440 [TCP segment of a reassembled PDU]
443  >  62984 [ACK] Seq=3163870 Ack=2592 Win=519 Len=1440 [TCP segment of a reassembled PDU]
62984  >  443 [ACK] Seq=36 Ack=369703 Win=4162 Len=0 SLE=372583 SRE=374023
"443  >  62984 [PSH, ACK] Seq=12888041 Ack=12810 Win=557 Len=1440 [TCP segment of a reassembled PDU]"
443  >  62984 [ACK] Seq=13220681 Ack=12810 Win=557 Len=1440 [TCP segment of a reassembled PDU]
443  >  58506 Len=34
[TCP Out-Of-Order] 443  >  62984 [ACK] Seq=2563063 Ack=2557 Win=519 Len=1440 [TCP segment of a reassembled PDU]
443  >  62984 [ACK] Seq=137406 Ack=36 Win=510 Len=1440 [TCP segment of a reassembled PDU]
[TCP Dup ACK 12670#1] 62984  >  443 [ACK] Seq=8340 Ack=8607368 Win=4162 Len=0 SLE=8608808 SRE=8610248
"443  >  62984 [PSH, ACK] Seq=3536354 Ack=3230 Win=522 Len=1440 [TCP segment of a reassembled PDU]"
62984  >  443 [ACK] Seq=3230 Ack=3295729 Win=4162 Len=0
"443  >  62984 [PSH, ACK] Seq=7374614 Ack=7062 Win=536 Len=1440 [TCP segment of a reassembled PDU]"
62984  >  443 [ACK] Seq=14088 Ack=14238638 Win=4162 Len=0
[TCP Out-Of-Order] 443  >  62984 [ACK] Seq=72239 Ack=36 Win=510 Len=1440 [TCP segment of a reassembled PDU]
[TCP Previous segment not captured] 443  >  62984 [ACK] Seq=9858506 Ack=9617 Win=545 Len=1440 [TCP segment of a reassembled PDU]
443  >  62984 [ACK] Seq=8042618 Ack=7701 Win=538 Len=1440 [TCP segment of a reassembled PDU]
443  >  62984 [ACK] Seq=10929926 Ack=10893 Win=550 Len=1440 [TCP segment of a reassembled PDU]
[TCP Out-Of-Order] 443  >  62984 [ACK] Seq=7082673 Ack=7062 Win=536 Len=1440 [TCP segment of a reassembled PDU]
Application Data
443  >  55662 Len=26
443  >  61183 Len=1246
443  >  62984 [ACK] Seq=197012 Ack=36 Win=510 Len=1440 [TCP segment of a reassembled PDU]
"443  >  62984 [PSH, ACK] Seq=13160201 Ack=12810 Win=557 Len=1440 [TCP segment of a reassembled PDU]"
62984  >  443 [ACK] Seq=12171 Ack=12399478 Win=4162 Len=0
[TCP Out-Of-Order] 443  >  62984 [ACK] Seq=1011559 Ack=675 Win=512 Len=1440 [TCP segment of a reassembled PDU]
"443  >  62984 [PSH, ACK] Seq=9369481 Ack=8979 Win=543 Len=1440 [TCP segment of a reassembled PDU]"
443  >  62984 [ACK] Seq=14329358 Ack=14088 Win=562 Len=1440 [TCP segment of a reassembled PDU]
"443  >  62984 [PSH, ACK] Seq=12271318 Ack=12171 Win=555 Len=1440 [TCP segment of a reassembled PDU]"
62984  >  443 [ACK] Seq=14088 Ack=14602787 Win=4162 Len=0
"443  >  62984 [PSH, ACK] Seq=3159550 Ack=2592 Win=519 Len=1440 [TCP segment of a reassembled PDU]"
[TCP Previous segment not captured] 443  >  62984 [ACK] Seq=2623905 Ack=2592 Win=519 Len=1440 [TCP segment of a reassembled PDU]
995  >  63663 [ACK] Seq=4740 Ack=338 Win=30464 Len=0
443  >  62984 [ACK] Seq=694129 Ack=675 Win=512 Len=1440 [TCP segment of a reassembled PDU]
62984  >  443 [ACK] Seq=2592 Ack=3097630 Win=4162 Len=0
"[TCP Previous segment not captured] 443  >  62984 [PSH, ACK] Seq=13055081 Ack=12810 Win=557 Len=1440 [TCP segment of a reassembled PDU]"
55335  >  443 Len=1250
63410  >  443 [ACK] Seq=2 Ack=41 Win=513 Len=0
62984  >  443 [ACK] Seq=5145 Ack=5568137 Win=4162 Len=0
62984  >  443 [ACK] Seq=1314 Ack=1479047 Win=4162 Len=0 SLE=1481927 SRE=1484807
443  >  62984 [ACK] Seq=11778341 Ack=11532 Win=552 Len=1440 [TCP segment of a reassembled PDU]
443  >  49926 Len=1200
62984  >  443 [ACK] Seq=1918 Ack=1931782 Win=4162 Len=0
"[TCP Previous segment not captured] 443  >  62984 [PSH, ACK] Seq=8557218 Ack=8340 Win=541 Len=1440 [TCP segment of a reassembled PDU]"
"[TCP Previous segment not captured] 443  >  62984 [PSH, ACK] Seq=776408 Ack=675 Win=512 Len=1194 [TCP segment of a reassembled PDU]"
443  >  54303 Len=25
"443  >  62984 [PSH, ACK] Seq=14254478 Ack=14088 Win=562 Len=1440 [TCP segment of a reassembled PDU]"
62984  >  443 [ACK] Seq=7701 Ack=8192378 Win=4162 Len=0 SLE=8193818 SRE=8195258
"443  >  62984 [PSH, ACK] Seq=7063347 Ack=7062 Win=536 Len=1440 [TCP segment of a reassembled PDU]"
RST. Root = 32768/0/34:a8:4e:07:9d:d8  Cost = 0  Port = 0x8001
443  >  62984 [ACK] Seq=10988251 Ack=10893 Win=550 Len=1440 [TCP segment of a reassembled PDU]
49926  >  443 Len=44
"443  >  62984 [PSH, ACK] Seq=8365497 Ack=8340 Win=541 Len=1440 [TCP segment of a reassembled PDU]"
RST. Root = 32768/0/34:a8:4e:07:9d:d8  Cost = 0  Port = 0x8001
62984  >  443 [ACK] Seq=10255 Ack=10735430 Win=4162 Len=0
62984  >  443 [ACK] Seq=6423 Ack=6851070 Win=4162 Len=0
"443  >  62984 [PSH, ACK] Seq=6015355 Ack=5784 Win=531 Len=1440 [TCP segment of a reassembled PDU]"
[TCP Out-Of-Order] 443  >  62984 [ACK] Seq=7416374 Ack=7062 Win=536 Len=1440 [TCP segment of a reassembled PDU]
62984  >  443 [ACK] Seq=10255 Ack=10827590 Win=4162 Len=0
[TCP Previous segment not captured] 443  >  62984 [ACK] Seq=10050001 Ack=9617 Win=545 Len=1440 [TCP segment of a reassembled PDU]
443  >  62984 [ACK] Seq=8094458 Ack=7701 Win=538 Len=1440 [TCP segment of a reassembled PDU]
62984  >  443 [ACK] Seq=5145 Ack=5162986 Win=4162 Len=0
[TCP Dup ACK 1453#44] 62984  >  443 [ACK] Seq=675 Ack=1136839 Win=4162 Len=0 SLE=1190119 SRE=1211719 SLE=1180039 SRE=1188679 SLE=1169959 SRE=1175719 SLE=1177159 SRE=1178599
63657  >  53 [ACK] Seq=1 Ack=1 Win=131072 Len=0
54303  >  443 Len=1250
443  >  62984 [ACK] Seq=1706820 Ack=1314 Win=515 Len=1440 [TCP segment of a reassembled PDU]
62984  >  443 [ACK] Seq=4506 Ack=4960596 Win=4162 Len=0
[TCP Previous segment not captured] 443  >  62984 [ACK] Seq=8495774 Ack=8340 Win=541 Len=1440 [TCP segment of a reassembled PDU]
"443  >  62984 [PSH, ACK] Seq=5552297 Ack=5145 Win=529 Len=1440 [TCP segment of a reassembled PDU]"
62984  >  443 [ACK] Seq=9617 Ack=9798026 Win=4162 Len=0
"443  >  62984 [PSH, ACK] Seq=10891444 Ack=10255 Win=548 Len=1221 [TCP segment of a reassembled PDU]"
62984  >  443 [ACK] Seq=12171 Ack=12605398 Win=4162 Len=0
443  >  62984 [ACK] Seq=5273770 Ack=5145 Win=529 Len=1440 [TCP segment of a reassembled PDU]
443  >  62984 [ACK] Seq=5881995 Ack=5784 Win=531 Len=1440 [TCP segment of a reassembled PDU]
443  >  62984 [ACK] Seq=11017051 Ack=10893 Win=550 Len=1440 [TCP segment of a reassembled PDU]
"443  >  62984 [PSH, ACK] Seq=14465987 Ack=14088 Win=562 Len=1440 [TCP segment of a reassembled PDU]"
"443  >  62984 [PSH, ACK] Seq=6946110 Ack=6423 Win=534 Len=1350 [TCP segment of a reassembled PDU]"
[TCP Dup ACK 14516#116] 62984  >  443 [ACK] Seq=9617 Ack=9995281 Win=4162 Len=0 SLE=10073041 SRE=10179601 SLE=10067281 SRE=10068721 SLE=10012561 SRE=10065841 SLE=9999601 SRE=10008241
"443  >  62984 [PSH, ACK] Seq=12642838 Ack=12171 Win=555 Len=1440 [TCP segment of a reassembled PDU]"
"443  >  62984 [PSH, ACK] Seq=5700001 Ack=5145 Win=529 Len=1440 [TCP segment of a reassembled PDU]"
62984  >  443 [ACK] Seq=7062 Ack=7569014 Win=4162 Len=0
62984  >  443 [ACK] Seq=675 Ack=1038919 Win=4162 Len=0
[TCP Out-Of-Order] 443  >  62984 [ACK] Seq=9774986 Ack=9617 Win=545 Len=1440 [TCP segment of a reassembled PDU]
62984  >  443 [ACK] Seq=9617 Ack=9729780 Win=4159 Len=0
443  >  62984 [ACK] Seq=7014049 Ack=6423 Win=534 Len=1440 [TCP segment of a reassembled PDU]
443  >  49926 Len=1200
443  >  62984 [ACK] Seq=1460327 Ack=1314 Win=515 Len=1440 [TCP segment of a reassembled PDU]
443  >  49926 Len=1200
[TCP Out-Of-Order] 443  >  62984 [ACK] Seq=1826060 Ack=1314 Win=515 Len=1440 [TCP segment of a reassembled PDU]
"[TCP Previous segment not captured] 443  >  62984 [PSH, ACK] Seq=8137658 Ack=7701 Win=538 Len=1440 [TCP segment of a reassembled PDU]"
"443  >  62984 [PSH, ACK] Seq=14406947 Ack=14088 Win=562 Len=1440 [TCP segment of a reassembled PDU]"
62984  >  443 [ACK] Seq=3230 Ack=3342760 Win=4162 Len=0
"[TCP Previous segment not captured] 443  >  62984 [PSH, ACK] Seq=11040865 Ack=10893 Win=550 Len=1440 [TCP segment of a reassembled PDU]"
62984  >  443 [ACK] Seq=10255 Ack=10406180 Win=4162 Len=0
443  >  62984 [ACK] Seq=10758470 Ack=10255 Win=548 Len=1440 [TCP segment of a reassembled PDU]
Application Data
[TCP Retransmission] 443  >  62984 [ACK] Seq=2606771 Ack=2592 Win=519 Len=1440
[TCP Dup ACK 14516#73] 62984  >  443 [ACK] Seq=9617 Ack=9995281 Win=4162 Len=0 SLE=10073041 SRE=10117681 SLE=10067281 SRE=10068721 SLE=10012561 SRE=10065841 SLE=9999601 SRE=10008241
"443  >  63619 [RST, ACK] Seq=1 Ack=1 Win=0 Len=0"
443  >  62984 [ACK] Seq=6885630 Ack=6423 Win=534 Len=1440 [TCP segment of a reassembled PDU]
62984  >  443 [ACK] Seq=7701 Ack=8252858 Win=4162 Len=0
443  >  62984 [ACK] Seq=4059222 Ack=3868 Win=524 Len=1440 [TCP segment of a reassembled PDU]
443  >  62984 [ACK] Seq=5684161 Ack=5145 Win=529 Len=1440 [TCP segment of a reassembled PDU]
Application Data
55335  >  443 Len=33
"443  >  62984 [PSH, ACK] Seq=438823 Ack=36 Win=510 Len=1440 [TCP segment of a reassembled PDU]"
62984  >  443 [ACK] Seq=6423 Ack=6866910 Win=4162 Len=0 SLE=6868350 SRE=6869790
62984  >  443 [ACK] Seq=675 Ack=871017 Win=4162 Len=0
RST. Root = 32768/0/34:a8:4e:07:9d:d8  Cost = 0  Port = 0x8001
62984  >  443 [ACK] Seq=2592 Ack=2741950 Win=4162 Len=0 SLE=2743390 SRE=2744830
[TCP Dup ACK 12981#1] 62984  >  443 [ACK] Seq=8340 Ack=8857298 Win=4162 Len=0 SLE=8861618 SRE=8863058 SLE=8858738 SRE=8860178
443  >  62984 [ACK] Seq=14184009 Ack=14088 Win=562 Len=1440 [TCP segment of a reassembled PDU]
443  >  49926 Len=250
62984  >  443 [ACK] Seq=8340 Ack=8664534 Win=4162 Len=0 SLE=8665974 SRE=8667414
62984  >  443 [ACK] Seq=36 Ack=506503 Win=4162 Len=0
[TCP Out-Of-Order] 443  >  62984 [ACK] Seq=1017319 Ack=675 Win=512 Len=1440 [TCP segment of a reassembled PDU]
"443  >  62984 [PSH, ACK] Seq=12415318 Ack=12171 Win=555 Len=1440 [TCP segment of a reassembled PDU]"
"[TCP Previous segment not captured] 443  >  62984 [PSH, ACK] Seq=13379081 Ack=12810 Win=557 Len=1440 [TCP segment of a reassembled PDU]"
"443  >  62984 [PSH, ACK] Seq=2229798 Ack=1953 Win=517 Len=1440 [TCP segment of a reassembled PDU]"
62984  >  443 [ACK] Seq=1953 Ack=2503398 Win=4162 Len=0
62984  >  443 [ACK] Seq=12171 Ack=12455638 Win=4162 Len=0
443  >  62984 [ACK] Seq=6338173 Ack=5784 Win=531 Len=1440 [TCP segment of a reassembled PDU]
62984  >  443 [ACK] Seq=14088 Ack=14704077 Win=4162 Len=0
62984  >  443 [ACK] Seq=10893 Ack=11221251 Win=4162 Len=0
[TCP Out-Of-Order] 443  >  62984 [ACK] Seq=5279530 Ack=5145 Win=529 Len=1440 [TCP segment of a reassembled PDU]
[TCP Dup ACK 17395#9] 62984  >  443 [ACK] Seq=12171 Ack=12220600 Win=4162 Len=0 SLE=12222040 SRE=12238198 SLE=12239638 SRE=12242518
443  >  62984 [ACK] Seq=5803868 Ack=5784 Win=531 Len=1440 [TCP segment of a reassembled PDU]
[TCP Dup ACK 2206#1] 62984  >  443 [ACK] Seq=1314 Ack=1640580 Win=4162 Len=0 SLE=1642020 SRE=1643460
443  >  63390 [ACK] Seq=41 Ack=3 Win=8 Len=0
